text;group;groupText;
Zaman hizla geciyor, cocuklar goz acip kapayincaya kadar buyuyor. En guzel karne hediyesi icin siz de hemen bir GARANTILI GELECEK HESABI actirin, onlarin gelecegi icin bugunden biriktirmeye baslayin. Ustelik akilli kumbarasi da hediye! ;1;Promosyon;
Mobil ile Herzaman Bahis Yapma Firsati Cebinde! Simdi 50 TL Mobil Bonus ile Keyfini Ikiye Katla! m.jojobet2<URL>;1;Promosyon;
Ahmet eğer fırında durursanız banada bi simit aldırabilirmisin ? ;2;Normal;
%50'ye varan Büyük Nike indirimi Basladi | Ücretsiz Kargo, 6 Taksit <URL>;1;Promosyon;
Fatura uyarısı: 48 saat içinde ödeme yapılmazsa hizmet durdurulacak. Arayın: <PHONE>;0;Dolandiricilik;
VakifBank Worldcarda 30 Nisana kadar gida,giyimde ilk 100TL sonrasi her 100TLye 10TL,maks50TL Worldpuan.NISAN yaz,kart son 6 hane 6635e gonder. vakifkart<URL>;1;Promosyon;
uyarı! Gümrük Müdürlüğü – gümrükte bekliyor. Hemen bilgi güncelleyin yoksa hukuki süreç başlatılacaktır. Tel: <PHONE>;0;Dolandiricilik;
SGK: aboneliğiniz iptal edilecek. bugün işlem yapmazsanızyasal takip başlatılacaktır. Dosya no: 595951. Tel: <PHONE>;0;Dolandiricilik;
100 TL VE UZERI VERGI ODEMELERINIZ 3 TAKSITE BOLUNECEKTIR. DETAYLI BILGI: <URL>;1;Promosyon;
Sıkma canını belki böylesi daha hayırlıdır;2;Normal;
shop.lacoste<URL>;1;Promosyon;
geçen geldiğimde yalçınlarda kaldım uzun süre mahçup oldum vs dedi bu sefer kimsede kalmıcam sizin ordaki misafirhaneyi düşünüyorum dedi;2;Normal;
36 aya varan vadelerle ihtiyac krediniz Deniz'den! Basvuru icin IHTIYAC yazin bir bosluk birakin TC Kimlik numaranizi 3280'e mesaj atin.;1;Promosyon;
Slm sahibinden com daki ilanını gördüm.  Bende tayin oldum ev arıyorum.  Yabanci biri olarak mevki neresi söyler misin.  Market yada kamu binası nere yakın.  Teşekkürler;2;Normal;
Hyundai'den secili modellerde %0 faiz ya da 4.404TL'ye varan nakit indirimine ek olarak ogretmenlere ozel fiyat avantajlari! Ozel Kod: HO011 <URL>;1;Promosyon;
Ödeme onayınız bekliyor. Devam etmek için link: <URL>;0;Dolandiricilik;
Deli çocuk;2;Normal;
INDIRIM: DERIMOD'da muhtesem FINAL. Ayakkabi ve cantalarda inanilmaz fiyatlar sizleri bekliyor. SMS istemiyorsaniz DERIMOD yazip 4933'e gonderebilirsiniz.;1;Promosyon;
Çok güzel abla kesin izle;2;Normal;
Dertleri belli adamların ne kağıtlar veriyor millet;2;Normal;
Parfumde buyuk firsat! Burberry Classic EDT Erkek Parfumu 100 ml sadece 99,90 TL! <URL>;1;Promosyon;
7-11 Mayis tarihleri arasinda Internet Subesi'ne giris yaptiniz, <URL>;1;Promosyon;
Ucuz atlattı o zaman;2;Normal;
Ok, iyi tatiller :);2;Normal;
Çevrimiçi yarı zamanlı is olarak seçildiniz;0;Dolandiricilik;
Faizsiz kredi fırsatı sizi bekliyor. Başvuru ve onay için: <URL>;0;Dolandiricilik;
3 tane çift kişilik oda var. 1 tane genç odası var;2;Normal;
Tamamdır haberlesiriz ;2;Normal;
Baskan para gelmisti dimi?;2;Normal;
Hizmet sağlayıcı bildirimi: kargonuz iade edildi. Borç/ceza için işlem yapılacaktır. 1 hafta içinde tıklayın: Tel: <PHONE>;0;Dolandiricilik;
Kripto airdrop: 0.5 BTC kazanma şansı! Cüzdan adresinizi doğrulayın: <URL>;0;Dolandiricilik;
Anladım tamam ses geliyor;2;Normal;
Oludenizdeki Ucretsiz Plajli Otelimizde 5Gun 4Gece Hersey Dahil Tatil 316TL! 0-12 Yas UCRETSIZ <URL>;1;Promosyon;
Sayin :Mehtap SAYGILI,Adiniza Tanimlanan 2650 TL Degerinde Samsung S6 Cep Telefonunuzu 3 Is Günü Almamaniz Durumunda Iade Olacaktir.Onay:<PHONE>;1;Promosyon;
Yillik abonelik kampanyanizdan kazandiginiz avantajlarinizi kaybetmeden bir ay sonra kampanyanizin otomatik olarak yenilenmesini isterseniz DEVAM yazip 2222 ye gonderebilirsiniz.;1;Promosyon;
Borç için ödeme yapılmadı. Hukuki işlem başlamadan önce arayın: <PHONE>;0;Dolandiricilik;
Sağolun. Bir kaç bir şey daha var hocam. Mail gönderdim. ;2;Normal;
Abi panel 330 liraya değişir;2;Normal;
Tum Urunlerde Sevgililer Gunune ozel %50'ye varan indirim magazalarimiz ve englishhome<URL>;1;Promosyon;
Hediye çeki bekliyor! 48 saat içinde talep et: <URL>;0;Dolandiricilik;
Çevrimiçi yarı zamanlı iş olarak seçildiniz;0;Dolandiricilik;
ilk fırsatta toplaşırız;2;Normal;
Tüm otel ve tur alisverislerinde gecerli siz üyemize özel %10 indirim kodunuz: YB18Z3 <URL>;1;Promosyon;
Futbolda aldim mehmet abide tavlada ikinci oldu ama onada verdiler aynısını;2;Normal;
DIGITURKTEN SASIRTAN TEKLIF!!BELGESEL DIZI AILE VE DAHA BIRCOK PAKET 5AY SADECE 5.99!!BUGUNE OZEL PROMOSYONLARLA KURULUM HEDIYE!! Son gun HEMEN ARA!! <PHONE>;1;Promosyon;
Tamam canım benim İpek  nasıl?;2;Normal;
İşte öyle rahat olduğunu görüyor, biliyorum;2;Normal;
Tüm otel ve tur alisverislerinde gecerli ekstra %10 indirim kodunuz:B23M29 Son gün Pazar <URL>;1;Promosyon;
ACİL! Tebrikler! Büyük ödülü kazandınız. Detaylar ve talep formu: <URL>;0;Dolandiricilik;
9-16 Mart tarihleri arasinda Internet veya Cep Subesi'ne giris yaptiniz, Xbox One'i 300 TL indirimli almaya hak kazandiniz. Kodunuzu Teknosa magazalari veya teknosa<URL>'dan kullanabilirsiniz. Keyifli alisverisler. Kodunuz: PR51569760807;1;Promosyon;
Nasılsınız zeynep abla iyimisiniz :);2;Normal;
Yilbasinda 60TL bonus! Market,benzin,giyim,elektronikteki Garanti POS'larinda 100TL'lik ilk 4 işleme 5'er TL, 5.'ye 25TL, toplam 45 TL bonus! Ustelik Bonus Flas'tan katilirsan son işleme 25 yerine 40TL, toplam 60TL bonus! ;1;Promosyon;
Yepyeni super teklif! Tam 1.300dk ayda sadece 14,90TL.Ustelik tum sabit hatlari ararken kullanabileceginiz paketteki dakikalarinizi 2 farkli Turkcell liyle ucretsiz ortak kullanabilirsiniz. Hemen PAYLASIM yazip 2222ye gonderin.;1;Promosyon;
Ahmet nasılsın.... Nerelerdesin..;2;Normal;
Vergi dairesi uyarısı: Eksik beyan nedeniyle inceleme başlatıldı. Evraklarınız için: <URL>;0;Dolandiricilik;
Güzelim benim için hiç problem değil. Hala Fethiyedeyiz. Çok uzadı Başka zaman görüşürüz :);2;Normal;
Platinum paket ile turbo hizinda asimsiz 4GB internet (ilk 3 ay 5GB) her yone 1500dk ve 1000SMS/MMS ayda 85TL! Ustelik kapida hizmet, oncelikli musteri hizmetleri ve diger Platinum ayricaliklarini yasama firsati. Hemen PLATINUM yazip 2222ye gonderin;1;Promosyon;
Kimliğiniz çalındı.doğrulama için hemen giriş yapın: <URL>;0;Dolandiricilik;
Tum Pijamalarda 1 ALANA 1 BEDAVA Kampanyamiz 30/11/2015 Tarihine kadar devam etmektedir. (Mesaj almamak icin RET yaz 3347'ye sms gonderiniz);1;Promosyon;
Elektrik faturanızda anormal tüketim tespit edildi. İtiraz için <PHONE>;0;Dolandiricilik;
Kampanya:Bugün özel 12.00-18.00 arasında tüm GoPro ürünlerinde ekstra %10 indirim!<URL>;1;Promosyon;
BABALAR GUNUNE OZEL:16-21 Haziran tarihleri arasinda tum erkek t-shirtlerinde 3 AL 2 ODE kampanyasi baslamistir.SMS almamak icin VENARET yazip 7889 a gonderin.;1;Promosyon;
BASIN EKSPRESIN EN YENI PROJESI AIRPORT24'TE LANSMAN FIRSATI DEVAM EDIYOR. %18 KDV DAHIL 238.000TL'DEN BASLAYAN FIYATLAR ICIN, <PHONE>;1;Promosyon;
Mehmet, doğum günün kutlu olsunn;2;Normal;
Bireysel Cep Subemize giris yaparak 7 Mart 2016'ya kadar ciceksatis<URL>'dan yapacaginiz bir alisverisinizde gecerli %25 indirim firsatini yakaladiniz! Kodunuz: FNM1<PHONE>;1;Promosyon;
Magazalarimiz ve fusion<URL>;1;Promosyon;
Hı Hı Hı Hı ?? Tamamdir kardesim. Ararim ben cikarken;2;Normal;
Ben Ankara'ya gelecektim aslında sonra sen nasılsa geleceksin diye vazgeçtim;2;Normal;
19-30 Eylul Tarihleri Arasinda  Erkek ve  Kadin ( basics) Tum Camasirlarda  2. urune % 50 INDIRIM. Magazalarimiza Bekler, Mutlu Bayramlar dileriz. Size Ozel Tekliflerimizi Almak Istemiyorsaniz DAGI  Yazip 3525'e Gonderebilirsiniz. MERSIS No:8-9796-7846-57;1;Promosyon;
Web sayfasında nerede ?;2;Normal;
Erken rezervasyonda bugün son! Size özel 1000TL üzeri alisveriste 100TL indirim kodunuz: B64EBS <URL>;1;Promosyon;
Son çağrı: Elektrik Dağıtım - ödemeniz onaylanmadı. 1 hafta içinde cevap vermezseniz yasal takip başlatılacaktır. Link: <URL>;0;Dolandiricilik;
Ben köye gidince erkenden demiyordum ohh mis gibi;2;Normal;
Ses nasil geliyor;2;Normal;
Fusion da NET %50 indirimler baslamistir. (Basic, aksesuar %30). Keyifli alisverisler. (Sms almaya devam etmek icin FSN izin yazip 7889 a ucretsiz gonderiniz).;1;Promosyon;
Kemer Marinem Diana Hotelde Kampanya! 3 Gece 4 Gun Hersey Dahil Tatil 315 TL Hemen Ara <PHONE>;1;Promosyon;
Bu sefer oyle gonderdim ben :) bi hata varsa yine duzeltiyim abi :);2;Normal;
UYARI: Adli işlemler Dairesi - ödeme onayı gerekmektedir. Hesabınızı korumak için hemen doğrulama yapın: <URL>;0;Dolandiricilik;
En azından yaşlı bakımdan hoca olması lazımdı.;2;Normal;
ACİL! Fatura uyarısı: 48 saat içinde ödeme yapılmazsa hizmet durdurulacak. Arayın: <PHONE>;0;Dolandiricilik;
Evet evet, bekliyorum;2;Normal;
Fusion da %70e varan indirimler baslamistir.Size ozel firsatlarimizdan yararlanmak istiyorsaniz FSN izin istemiyorsaniz FSN ret yazip 7889 a gonderebilirsiniz.;1;Promosyon;
Sorun cok büyüdü burda elektirikler kople gitti butun sistemler kapandi;2;Normal;
Samsung Galaxy S6 Edge cep telefonu ucretsiz kargo avantaji ile sadece 2.599 TL. <URL>;1;Promosyon;
ÖDEME ONAYLANMADI. Kartınız bloke olabilir. Hemen kontrol için tıklayın: <URL>;0;Dolandiricilik;
Bonus'a 7 taksitle Kigili Festiva Outlet Mugla'da %70+%20 indirim!Ucretsiz SMS almak istemiyorsaniz SMSIPTALyazip 3342ye gonderin.Mersis:0879001756600379;1;Promosyon;
Gerçekten çok ilginç neye takıldılar anlamadım;2;Normal;
Kampanya: VakifBank Worldcardla 26 Eylul ? 23 Ekim arasinda CarrefourSA da yapacaginiz toplam 200 TL alisverisinize 20 TL Worldpuan. Katilmak icin CARREFOURSA yazin kart son 6 hanesini 6635e gonderin. Kampanya SMSi istemiyorsaniz VBRED yazin 6757ye ucretsiz gonderin.;1;Promosyon;
23 Nisan Kutlu Olsun! Biletinizi 1-30 Nisan arasinda alin,10-30 Nisan arasi ucuslarda cocuklarimiza ozel %50 indirim firsatini kacirmayin! <URL>;1;Promosyon;
Sınav soruları da bunlar çok objektif. Değerlendirmeye açık ve dehidro lu olan soruyu hiç duymadım hayatımda;2;Normal;
Instagram: hesabınız geçici olarak kısıtlandı. Kimlik doğrulaması yapmazsanız kapatılacaktır: <URL>;0;Dolandiricilik;
Kargonuzla ilgili bilgi almak için arayın: <PHONE>;0;Dolandiricilik;
Nerde kalıyorsunuz;2;Normal;
Tamamdır hocam İyi günler;2;Normal;
Açmiyor;2;Normal;
Konusmaci degisince belki o arada ayarlayabilirsin;2;Normal;
Hesabınız kapatılacak. Onay için hemen tıklayın: <URL>;0;Dolandiricilik;
TANITIM: GULER YUZLU PERSONELiMiZ VE YENi MODELLERiMiZ iLE YENi PLAZAMIZDA HiZMETiNiZDEYiZ. CUMHURiYET MAH. FETHiYE KARAYOLU UZERi NO: 54 (ZENGiN TiCARET YANI) ORTACA. TEL: <PHONE>;1;Promosyon;
iyi oturuyoruz sen napiosun arabayı burda bırakmışın :);2;Normal;
PTT uyarısı: kargonuz iade edildi. Lütfen 1 hafta içinde aşağıdaki linkten doğrulayın: <URL>;0;Dolandiricilik;
Digiturkte Dev Firsat Hemen uye olun Yuzlerce kanal ve LigTVyi 60TL Yerine 12Ay%40 indirimle Sadece 39TLye izleyin Hemen Arayn Baglayalm <PHONE>;1;Promosyon;
Tamamdır;2;Normal;
Spora vaktiniz yok ama hep baslamak istiyorsunuz degil mi?Fitwell in 1 yillik programi simdi 59TL yerine sadece 39TL!Hemen 2222ye YILLIKFIT yazin,hep fit kalin!;1;Promosyon;
FIRSAT:Money Dostu, tam senlik oldugunu dusundugumuz FILIZ OZEL LEZZETLER MAKARNA CESITLERI 350G 1,45TL!10-23 Aralik'ta Migrosta. Bilgi icin, <PHONE>;1;Promosyon;
Adınıza işlem yapılmıştır. İptal için tıklayın: <URL>;0;Dolandiricilik;
TAKSiTLi NAKiT AVANS ARTIK UCRETSiZ! USTELiK 0011 iLE BiTEN KARTINIZLA 9 TAKSiTE OZEL %2,02 YERiNE %1,49 FAiZLE! SON GUN 31 MART bonus<URL>;1;Promosyon;
Boyner'de Shell'den 30TL degerinde yakit kazanma firsati!14-30 Kasim tarihleri arasinda Boyner Anahtarla 300TL uzeri alisveriste kazanilir. Bilgi icin <PHONE>;1;Promosyon;
Ben de ttlım teşekkür ederim herşey için.;2;Normal;
Fabrika'nin yaz sezonuyla ilk siz tanisin istedik. 400 TL'lik alisverisinize aninda %25 indirim veya Hopi'lilere %35 paracik icin magazalarimiza bekliyoruz. Keyifli alisverisler. Detayli bilgi icin <PHONE>;1;Promosyon;
Paket teslim edilemedi. Yeni teslim tarihi seçmek için tıklayın veya <PHONE>;0;Dolandiricilik;
e-Vadeli'de %11,50'ye varan kampanya faizlerini kacirmayin! Siz de para cekseniz bile vadesi bozulmayan e-Vadeli hesap acin kampanyalardan faydalanin. Mevcut kampanyalari incelemek icin: goo.gl/c7MDEA. ;1;Promosyon;
Kampanya,VakifBank Worldcardla 31Temmuza kadar World uyesi Petrol Ofisinde farkli gunlerde 4 adet 100TL harcamaniza 1-10 Agustos arasi World uyesi Petrol Ofisinde 25TL indirim.PO yaz kart son 6 hane 6635e gonder. Kampanya SMSi almak istemiyorsaniz VBRED yazin 6757ye ucretsiz gonderin. Bilgi: <URL>;1;Promosyon;
Merhaba hocam geldim ben :);2;Normal;
Alanya Denize Sifir 4* Raina Beach Hotel 14 yas ucretsiz 4 gece 5 gun hersey dahil 249 TL <PHONE>;1;Promosyon;
Ödeme doğrulaması gerekli. Link: <URL>;0;Dolandiricilik;
Banka hesabınıza izinsiz giriş tespit edildi. Hemen doğrulamak için tıklayın: <URL>;0;Dolandiricilik;
Abi kusura bakma Özür dilemekten bi hal oldum :p abi 40 liraya bize geliyor parça herşey dahil 60 desen 10 numara olur.;2;Normal;
KAMPANYA: EN UYGUN FIYATLI TRAFIK SIGORTASINA YESIL ISIK YAKTIK! HEMEN ARAYIN <PHONE>;1;Promosyon;
Firsatlar bitmez Avea'yla! Avealilara ozel Rossmann'dan Alterra Naturel ve Sunozon markali urunlerde gecerli olacak %25 indirim! ROSSMANN yazin 5060'a gonderin, sifreniz cebinize gelsin;1;Promosyon;
Benim için çok uzun bi tatil oldu;2;Normal;
Mahkeme: Kimlik doğrulama eksik. adli işlem başlatılacak. Detay: <URL>;0;Dolandiricilik;
Telefon numaranızla ilgili acil bildirim: Ödeme talebi var. Sorunu çözmek için <PHONE>;0;Dolandiricilik;
FARK ALMIYORUZ!! Fizik Tedavi polikliniklerimizde muayene ucret farki almiyoruz. Randevu <PHONE>;1;Promosyon;
Hemen takip no vs öğreneyim;2;Normal;
Paraf ile gib.gov.tr den yapacaginiz MTV odemelerinize 3 veya 5 taksit! Ustelik Onur Air'den tum ucuslarda %30 indirim firsatiyla <URL>;1;Promosyon;
adidas ürünlerinde %40'a varan Büyük Sezon Final indirimi | Ücretsiz Kargo 6 Taksit  <URL>;1;Promosyon;
Gayet iyi;2;Normal;
GÜNÜN FIRSATI DENIZE SIFIR DIDIM BEGONVILLE OTELDE 5GECE 6GUN HERSEY DAHIL KISI BASI 439TL 0-12 YAS FREE <PHONE>;1;Promosyon;
Para cekseniz bile vadesi bozulmayan, yuksek faiz oranlari ile daha cok kazandiran e-Vadeli hesap Internet ve Cep Subesi'nde. Siz de hemen e-Vadeli hesabin avantajlarindan faydalanin! Bilgi icin: goo.gl/c7MDEA;1;Promosyon;
Kampanya: Money Dostu, bu oneri kacmaz! Money Bonus kredi kartinla tek seferde 75 TL harcamana 10 TL aninda indirim, 29 Agustos-6 Eylulde Migros ve Tansasta! Alkol, sigara, TL yukleme, kurban ve elektronik harictir. Bilgi: <PHONE>;1;Promosyon;
Fatura uyarısı: 48 saat içinde ödeme yapılmazsa hizmet durdurulacak. Arayın: <PHONE>;0;Dolandiricilik;
Facebook: Hesabınızda olağan dışı etkinlik tespit edildi. Kurtarmak için giriş yapın: <URL>;0;Dolandiricilik;
Su faturası gecikmiş;0;Dolandiricilik;
İçi marmelat dolu bir cam kavanoz, gün gelir geçiciliğimizi hatırlatır bize..;2;Normal;
Mabollada tanistim yeni uyelerle;2;Normal;
Avea Online Islemler Mobil Uygulamasi ile işlemlerinizi dilediginiz yerden, data kullanim ucreti odemeden aninda gerceklestirebilirsiniz. <URL>;1;Promosyon;
Gectik seni bekliyoruz;2;Normal;
15 TL İndirim Çeki bukrecem@gmail<URL> Hesabınızda! Bu Fırsatı Kaçırmayın - <URL>;1;Promosyon;
Kaza kaydı oluşturuldu. İtiraz için <PHONE>;0;Dolandiricilik;
SIZLERE SUBAT SURPRIZI! INANAMAYACAGINIZ 4.99 TL.DEN BASLAYAN FIYATLARLA COK KISA BIR SURE ICIN DEFACTO COCUK URUNLERI  MAGAZAMIZDA sms-istemiyorum<URL>/ilu1v_ ;1;Promosyon;
KAMPANYA: KIGILI ve ABDULLAH KIGILI'da size ozel 30 TL hediyemiz var. 200 TL uzeri ilk alisverisinizde 19 Mayis'a kadar keyifle harcamaniz dilegiyle. Ustelik %50 NET INDIRIM devam ediyor. Bilgi icin sabit hatlardan ucretsiz: <PHONE>;1;Promosyon;
Zeynep banka değişti bizim;2;Normal;
Kayıp paket: Kargonuz adres bilgisi eksik.doğrulamak için linke tıklayın: <URL>;0;Dolandiricilik;
ACİL! Hediye çeki bekliyor! 48 saat içinde talep et: <URL>;0;Dolandiricilik;
SON 2 GUN! Cekilise hemen katilin, birbirinden degerli 28 hediyeden 1'i sizin olsun. DETAYLI BILGI VE KATILIM ICIN: <URL>;1;Promosyon;
Yavas yavaş toparliyorum islerimde oldugu icin surekli ugrasamiyorum ama durum iyi;2;Normal;
Anında kredi: 15.000 TL onaylandı. Onaylamak için tıklayın: <URL>;0;Dolandiricilik;
Tamamdır saolasım;2;Normal;
Nilay'a vereyim mi ceketini;2;Normal;
Zeyno biz muhtemelen otele gideceğiz ev yok villalar pahalı;2;Normal;
Son çağrı: Vergi Dairesi - hesabınızdan yetkisiz çekim. 3 gün içinde cevap vermezseniz yasal takip başlatılacaktır. Link: <URL>;0;Dolandiricilik;
TUM COSKUSUYLA TUM REYONLARDA %50'YE VARAN NET VE US POLO TUM URUNLERDE %30 NET OGRETMENLER GUNUNE OZEL INDIRIM TUM MUSTERILERIMIZ ICIN BASLADI! <URL>;1;Promosyon;
TUM URUNLERDE %50+%50 EKSTRA INDIRIM! 22 KASIM'A KADAR MUGLA MAGAZALARINDA! KACIRMAYIN! (SMS IPTAL:5830'A MC). MERSIS: 0273065777400019 madamecoco<URL>;1;Promosyon;
Tum borclarinizi kapatip 36 ay vadeli tek kredide birlestirmek icin, IHTIYAC (bosluk) KREDI TUTARI yazip bu mesaji cevaplayin! 4,9TL (OR:IHTIYAC 50000);1;Promosyon;
Yalçına bi sormak lazım :);2;Normal;
İade talebiniz bekliyor. Kimlik doğrulama: <URL>;0;Dolandiricilik;
Uğur aradı mı seni bu hafta sonu sınav görevi için;2;Normal;
Her şey tamam niye tekrar teyit alıyorlar anlamadım;2;Normal;
Bugune ozel super firsat! 2249 TL'ye Apple iPhone 6 - 16 GB akilli telefon, 75 TL Worldpuan hediye <URL>;1;Promosyon;
Bizimkileri falan çağırırz;2;Normal;
Tergan Erkek Deri Botlarda tek fiyat 99 TL! Ustelik bugune ozel 100 TL ve uzerine ekstra %25 indirim + Ucretsiz Kargo! <URL>;1;Promosyon;
Sn KARASOY, Size ozel 25TL INDIRIM! 13 Aralik'a kadar 150TL uzeri ilk alisverisinizde keyifle harcayin! Ustelik KIGILI ve ABDULLAH KIGILI'da %60 Indirim ve cek firsati devam ediyor. Bilgi: <PHONE>;1;Promosyon;
Enerjik, güçlü ve çekici! Davidoff Cool Water EDT kadın ve erkek parfümü sadece 99,90 TL!<URL>;1;Promosyon;
Gebelikte yürüyen kadınlar çok daha rahat ve kolay doğum yapıyor;2;Normal;
Ne demek :);2;Normal;
Yatırım platformu %300 garanti ile açıldı. Üye olmak için: <URL>;0;Dolandiricilik;
YENI DESENLERIYLE, PAMUKLU BATTANIYELERDE EKSTRA INDIRIM! CIFT KISILIK 130TL YERINE 39.90TL, TEK KISILIK 110TL YERINE 34.90TL. MAGAZALARDA VE madamecoco<URL>'DA;1;Promosyon;
Faizsiz kredi fırsatı sizi bekliyor. Başvuru ve onay için: <URL>;0;Dolandiricilik;
Faceden indirebilir miyiz;2;Normal;
Eviniz siz gelmeden isinsin, ustelik faturanizda %30 tasarruf saglasin. Cepten yonetilen, kablosuz Cosa Akilli Kombi Kiti sadece 249TL! <URL>;1;Promosyon;
Kazandiginiz ParafParalari daha degerli hale getirmek icin ARTAN bosluk kartinizin son 6 hanesini yazarak 3404'e gonderin!Detay parafcard<URL>;1;Promosyon;
İyidir akşam işin varmı;2;Normal;
ACİL: Adınıza yasal işlem başlatıldı. İtiraz için 48 saat içinde <URL>;0;Dolandiricilik;
Vergi dairesi uyarısı: Eksik beyan nedeniyle inceleme başlatıldı. Evraklarınız için: <URL>;0;Dolandiricilik;
Süvari Erken Kış Fırsatları, Montlar,Ayakkabılar,Ceketler 99,90 TL.Yeni Sezon Takım Elbise 249,90 TL.İptal İçin SUVARI Yaz 3347'e Gönder.Mersis:<PHONE>;1;Promosyon;
Garanti ile calismaya devam edin kredi dunyasinin ayricaliklarini kacirmayin! Size ozel kampanyalarimizla ilgili bilgi almak icin <PHONE>;1;Promosyon;
AVEA ile YILDIZLAR Acikhava Sahnesinde! Profesyonel Tarife musterilerine ozel, 21 Eylul'deki Guldur Guldur konser biletinizi Biletix'ten %50 indirimli almak icin PROF GULDUR GULDUR yazip 5060'a gonderin, sifreniz cebinize gelsin.Detaylar: avea.co/pro;1;Promosyon;
HOTIC'te Yilbasina Ozel NET %60 + 2. urune %20 INDIRIM! Zamansiz urunler haric. SMS almamak icin HOTIC yazip 3172'ye gonderebilirsiniz. Mersis: 0464001939500012;1;Promosyon;
Kampanya: 100 TL'ye varan Worldpuan kampanyasi icin son gun Pazar. <URL>;1;Promosyon;
Ugurlu Kutuphane'nin bugunku konugu Azra Kohen. <URL>;1;Promosyon;
Yemek karti istiyon mu?;2;Normal;
6-7 Agustos'daki alisverisinizde 100 TL'ye varan hediye ceki kazanin! <URL>;1;Promosyon;
Kartınız bloke edildi. İptal işlemi için görüşün: <PHONE>;0;Dolandiricilik;
Kredi limitiniz onaylandı. Kredi detayları ve sözleşme: <URL>;0;Dolandiricilik;
Bankamatik Karti'nizi alisverislerinizde de kullanabilir, ustelik hem MaxiPuan kazanabilir, hem de nakit tasima riskinden kurtulabilirsiniz. Iletisim tercihlerinizi degistirmek icin:Internet Subesi veya <PHONE>;1;Promosyon;
VENA magazalarinda secili urunlerde gecerli %50'ye varan YENI YIL INDIRIMI basladi!SMS almak istemiyorsan VENA RET yaz 7889 a gonder.Mersis no:0924004278000017;1;Promosyon;
Senin aklında bir şey varsa onu izleyelim;2;Normal;
<URL>;1;Promosyon;
Tebrikler! Ücretsiz tablet kazandınız. Kargo ve vergi ücreti ödemesi için: <URL>;0;Dolandiricilik;
Benim makine kasmistir belki basta;2;Normal;
E-Devlet güvenlik uyarısı: vergisel yükümlülük tespit edildi.doğrulama için: (24s içinde). Tel: <PHONE>;0;Dolandiricilik;
Ödeme onayınız bekliyor. Devam etmek için link: <URL>;0;Dolandiricilik;
Eve internet alirken secim karmasasina son.Limitsiz ADSL ayda 49,90TL!Ustelik 5TL'ye 2kat hiz firsatiyla!Hemen arayin:<PHONE>;1;Promosyon;
"2 ayda 250.000 taraftarin indirdigi uygulamayi siz de deneyin; Super Lig'in 12. haftasinda Besiktas ile Trabzonspor karsi karsiya geliyor! Fenerbahce Balikesir deplasmanina giderken, Galatasaray Akhisar'i konuk edecek. Takiminiza ozel uygulamayi UCRETSIZ INDIRIN";1;Promosyon;
SGK prim eksikliği. Cezadan kaçınmak için <PHONE>;0;Dolandiricilik;
HOTIC'te Tum Kadin Botlarda NET %70 INDIRIM. Bilgilendirme almak istemiyorsaniz HOTIC yazip 3172'ye gonderebilirsiniz. Mersis:0464001939500012;1;Promosyon;
Rahatsız olunacak ne var gerçekten anlayamıyorum çünkü :(;2;Normal;
Konuştuk doluymuş sen istediğin yer neresi olursa yaz biz de konuşuruz;2;Normal;
Mahkeme: vergisel yükümlülük tespit edildi. yasal takip başlatılacaktır. Detay: <URL>;0;Dolandiricilik;
Tebrikler! Büyük ödülü kazandınız. Detaylar ve talep formu: <URL>;0;Dolandiricilik;
Mahkeme güvenlik uyarısı: hesabınız bloke edildi.doğrulama için: <URL>;0;Dolandiricilik;
Alirim kardesim. Sabah cikarken ararim;2;Normal;
Vergi Dairesi uyarısı: Borcunuz nedeniyle banka hesaplarınıza bloke gelebilir. Detaylar: <URL>;0;Dolandiricilik;
Şaştım walla;2;Normal;
Tum English Home goblen, kirlent ve koltuk sallari %50 indirimle magazalarimizda. SMS almamak icin RET yazip 4909'a gonderin.Mersis:0326026979700012;1;Promosyon;
4-7 Eylul tarihleri arasinda Internet veya Cep Subesi'ne giris yaptiniz, Pegasus'un mobil site ve uygulamalarindan yapacaginiz yurtdisi ucak bileti aliminda gecerli %30 indirim kazandiniz. Detaylar: <URL>;1;Promosyon;
Telefonunuzda virüs tespit edildi. Temizlemek için tıklayın: <URL>;0;Dolandiricilik;
20 Nisan tarihinde Internet veya Cep Subesi'ne giris yaptiniz, arzum<URL>;1;Promosyon;
Bu klip işini nasıl halledicez sen denedin mi fbye yüklemeye? İzin veriyor mu;2;Normal;
HAFTANIN KAMPANYASI:NAKISLI ABAJURLAR 175TL YERINE 49.9TL, NEVRESIM TAKIMLARI VE CARSAFLARDA %50+%50 EKSTRA INDIRIM! (SMS ALMAMAK ICIN MC YAZIN 5830'A GONDERIN);1;Promosyon;
Hoşgeldin;2;Normal;
uygunsan goruselim;2;Normal;
Müdürüm karar veriyor pazar akşam dönüyorum, gitmeden görebilirim inşallah;2;Normal;
Sleepy<URL>;1;Promosyon;
Tmm kırpıp koy o zaman bunu;2;Normal;
Sistemimiz ödeme sahteciliği tespit etti. Hesap güvenliği için doğrulama: <URL>;0;Dolandiricilik;
Evet evet;2;Normal;
İnşallh olur ya;2;Normal;
gencTarifeli! HER YONE 31 gunluk 10 dksi 75 Kr indirimin sona erdi. 20 TL yukle, 31 gun HER YONE indirim kazan;1;Promosyon;
Hediye çeki bekliyor! 48 saat içinde talep et: <URL>;0;Dolandiricilik;
Tam izleyemedim sinemadayım ama baktığım kadarıyla güzel görünüyor;2;Normal;
SEVGiLiLER GUNUNE OZEL YEPYENi  YEMEK TAKIM KAZANDINIZ HEMEN ARAYIN TEL:<PHONE>;1;Promosyon;
E-Postadoğrulama: Hesabınız için gönderilen OTP kodunu <PHONE>;0;Dolandiricilik;
Ev eglencesinin keyfini Samsung 40H5570 Smart Led TV ile cikarin. Dahili uydu alici, Wifi, 2 yil Samsung TR Garantisi ve ucretsiz kargo ile 1389TL! <URL>;1;Promosyon;
Abi S3 cam 70 tl ;2;Normal;
Faizsiz kredi fırsatı sizi bekliyor. Başvuru ve onay için: <URL>;0;Dolandiricilik;
Süvari'den 2'li Fırsatlar, 2 Gömlek 69,90 TL, 2 Pantolon 129,90 TL.Ayakkabı + Kemer 149,90 TL.İptal İçin SUVARI Yaz 3347'e Gönder.Mersis No:<PHONE>;1;Promosyon;
Kredi limitiniz onaylandı. Kredi detayları ve sözleşme: <URL>;0;Dolandiricilik;
BUYUK INDIRIM!! YILIN ILK INDIRIMI GAZIMUHTAR PASA BLV. & FORUM AVM adidas'tan. %35'e VARAN INDIRIMLER SIZLERI BEKLIYOR. MUTLU YILLAR;1;Promosyon;
Telefon numaranızla ilgili acil bildirim: Ödeme talebi var. Sorunu çözmek için <PHONE>;0;Dolandiricilik;
Sistemimiz ödeme sahteciliği tespit etti. Hesap güvenliği için doğrulama: <URL>;0;Dolandiricilik;
Merhaba hocam Şu an için gelen bi evrak yok;2;Normal;
Oyle oldu valla tablet kazandim burda da onlarda verdi :);2;Normal;
Aldım makineyi film ve kayış da verdi adam;2;Normal;
Hazır mıyız;2;Normal;
Vergi Dairesi uyarısı: hesabınız bloke edildi. Lütfen derhal aşağıdaki linkten doğrulayın: <URL>;0;Dolandiricilik;
Sahte vergi bildirimi: Vergi borcunuz var. İcra gelmeden önce <PHONE>;0;Dolandiricilik;
Nietzsche zorlamaz rahat rahat okursun egzistansiyalistlere öncelik ver;2;Normal;
Kadin aradi ogluyla bize geliyo su an bide o aradi bilgin olsun aricam seni ilk firsatta;2;Normal;
Bugün öyle arabayla geziyorduk da rastgele bulduk, içine girmeye çalıştık da kapalıydı;2;Normal;
Hocam günaydın, ben şimdi kütüphaneye gitmek lstiyorum. Nasıl yapalım?;2;Normal;
