text;group;groupText;
Baska var mi düşündüğünüz;2;Normal;
uyarı! SGK – hesabınızdan yetkisiz çekim. Hemen bilgi güncelleyin yoksa hesabınız kalıcı olarak kapatılacak. Tel: <PHONE>;0;Dolandiricilik;
Hesabınız kapatılacak. Onay için hemen tıklayın: <URL>;0;Dolandiricilik;
Tum nakit ihtiyac ve odemelerinizde kullanabileceginiz 3000 TL kredili mevduat hesabiniz hazir. Sizi 13/07/2015  tarihine kadar en yakin subemize bekliyoruz.Iletisim tercihlerinizi degistirmek icin Paramatikler ve <PHONE>;1;Promosyon;
SON GUNLER! Hendek Parkshop KIGILI'nin Buyuk Indirim Panayiri bitiyor! %70+%20 INDIRIM ile yaz koleksiyonuna ozel son firsati kacirmayin!;1;Promosyon;
Ben tam bir Ayakkabı Delisiyim diyorsanız yeni sezon ayakkabı modellerimiz için <URL>;1;Promosyon;
hatirlayamadım valla resetleyip yeniden ayarlamak lazım;2;Normal;
Kampanya: 1100.00 TL tutarindaki işleminizi aylik 378.98 TL lik taksitle 3 ayda odemek icin BOL yazip bosluk birakin, 02 yazin 6635e gonderin. Aylik faiz yuzde 1.39, yillik maliyet yuzde 20.01 dir. Kampanya SMS istemiyorsaniz VBRED yazin 6757ye ucretsiz gonderin.;1;Promosyon;
Saolasin dusunmuyorum;2;Normal;
Yatırım platformu %300 garanti ile açıldı. Üye olmak için: <URL>;0;Dolandiricilik;
Sigortayeri<URL>'dan zorunlu trafik sigortasi yaptiran TTNET'liler faturalarinda 20TL indirim kazaniyor!TTNET bosluk TCKN bosluk Plaka No yazip,3950'e SMS gönder;1;Promosyon;
Abicim herşey için teşekkür ederim tamamdır hiçbir sıkıntı yok kayıt tamamlandı ;2;Normal;
7400.00TL TAKSITLI PARAYI 9 AYDA 924.92 TL TAKSITLE ALMAK ICIN PARA YAZ KART SON6 NOYU 3340'A YOLLA.SON GUN 31.03.2015.FAIZ %1.99,YMO %29.<PHONE>;1;Promosyon;
Neden göndermiyorsun kandırıkçı  yeğen;2;Normal;
Sıkıntı yok,);2;Normal;
Hadi bakalım iyi şanslar;2;Normal;
Evet Yunus C.tesi çıkıcaz yola P.tesi babm dönecek;2;Normal;
Gümrük Müdürlüğü: gümrükte bekliyor. hemen işlem yapmazsanızhukuki süreç başlatılacaktır. Tel: <PHONE>;0;Dolandiricilik;
"Hiç birine gerek yok ;)";2;Normal;
Kartınız bloke edildi. İptal işlemi için görüşün: <PHONE>;0;Dolandiricilik;
O zaman da aa farketmemisim dersin;2;Normal;
Size özel kampanya ve bilgilendirme yapabilmemiz için Opet'e verdiğiniz kişisel ve alışveriş bilgilerinizin işlenerek, çeşitli kanallardan sizinle iletişime geçmemize izin veriyorsanız İZİN AD SOYAD yazın 6738'e gönderin,hediyenizi kazanın!;1;Promosyon;
Paket teslim edilemedi. Yeni teslim tarihi seçmek için tıklayın veya <PHONE>;0;Dolandiricilik;
Tam 20TL bonus firsati! 10-16 Temmuz arasi Bonus Platinum ile istediginiz yerde toplam 300TL alisveris yapin, 20TL bonus kazanin! 3340a SANS yazin,gonderin bonus<URL>;1;Promosyon;
Adalet Bakanlığı uyarısı: Kimlik doğrulama eksik. Lütfen derhal aşağıdaki linkten doğrulayın: <URL>;0;Dolandiricilik;
Sadece 24 saat surecek super firsat! 2249 TL'ye Apple iPhone 6 - 16 GB akilli telefon, 75 TL Worldpuan hediye <URL>;1;Promosyon;
Internet Subemizde 1V1Y<URL>'dan 150 TL'lik alisverisinizde aninda 15 TL indirim firsatini kacirmayin! Kampanyaya katilmak icin son gun 18 Eylul. Iletisim tercihlerinizi degistirmek icin:Internet Subesi veya <PHONE>;1;Promosyon;
İyiyim ya;2;Normal;
SGK kaydınız askıya alındı. Ayrıntılar için arayın: <PHONE>;0;Dolandiricilik;
Evden çalışma işi: Hemen başvuru yapın;0;Dolandiricilik;
5 Mayis'a kadar 501041 ile biten kartinizla 50TL ve uzeri ilk taksitli alisverisinize 20TL BONUS! KARAR yazin kart son 6haneyi 3340'a gonderin! bonus<URL>;1;Promosyon;
"Sıkıntı yok bi kaç ilaç yazdı 2 günde rapor önmli bişey yok ama ;)";2;Normal;
Ödeme doğrulaması gerekli. Link: <URL>;0;Dolandiricilik;
HOTIC, Kusadasi AVM'de acildi! Tum Cizmelerde NET %70 + ikinci urune %20 INDIRIM! SMS almamak icin HOTIC yazip 3172ye gonderebilirsiniz. Mersis:0464001939500012;1;Promosyon;
VakifBank Worldcardla 31 Marta kadar sube veya <PHONE>;1;Promosyon;
World'e ozel 50TL'ye varan Worldpuan ve 9 taksit firsatini kacirmayin, tiklayin <URL>;1;Promosyon;
Aidat borcunuz icra edilmeden önce yapılandırma için tıklayın: <URL>;0;Dolandiricilik;
Kampanya: VakifBank Worldcardinizla 100 TL ve uzeri Motorlu Tasitlar Verginizi <URL>;1;Promosyon;
Evet Yunus saçımı kestirdim de duştaydım yeni gördüm siz naptınız nerdesinz?;2;Normal;
Kampanya:HOTIC'te Erkek ayakkabilarinda NET%60 INDIRIM (Zamansiz urunler gecerli degildir)Bilgilendirme almak istemiyorsaniz HOTICyazip 3172ye gonderebilirsiniz;1;Promosyon;
Adınıza işlem yapılmıştır. İptal için tıklayın: <URL>;0;Dolandiricilik;
Sıkıntı yok;2;Normal;
Hpşbulduk hocam :) 13:00'de toplanıyoruz değil mi?;2;Normal;
Kaza kaydı oluşturuldu. İtiraz için <PHONE>;0;Dolandiricilik;
Ok teşekkürler;2;Normal;
Annemlerdeyiz İlker de bizde;2;Normal;
Tamam gayet profesyonel görünüyor ilan.;2;Normal;
Kargonuzla ilgili bilgi almak için arayın: <PHONE>;0;Dolandiricilik;
50TL bonus! Bonus'a uye market,akaryakit ve restoranda her 100TL harcamaya 10TL,toplam 50TL bonus! Ilk harcamadan once KAZAN yaz 3340'a gonder.Son gun 19 Temmuz! Bilgi: bonus<URL>;1;Promosyon;
Gunun super firsati Korkmaz Elektrikli Caydanlik ucretsiz kargo ile sadece 109,90TL! <URL>;1;Promosyon;
Akbank Direkt Mobil'e girin, 20 Havale ve 2 EFT hediyenizi aninda kazanin! Para transferlerinizi bir ay UCRETSIZ yapin! <URL>;1;Promosyon;
Faizsiz kredi fırsatı sizi bekliyor. Başvuru ve onay için: <URL>;0;Dolandiricilik;
Hesabınızda yabancı giriş denemesi var. Oturum kapatıldı. Tekrar açmak için: <URL>;0;Dolandiricilik;
Kartınız bloke edildi. İptal işlemi için görüşün: <PHONE>;0;Dolandiricilik;
Su faturası gecikmiş;0;Dolandiricilik;
Kredi limitiniz onaylandı. Kredi detayları ve sözleşme: <URL>;0;Dolandiricilik;
HGS yuklemek bir SMS e bakar. Turkcell Mobil Odeme ile HGS nize 10 TL yuklemek icin PLAKA bosluk 10 yazip 1447 ye gonderebilirsiniz.Turkcell in kampanya ve hizmetlerinden sizi haberdar etmemizi istemiyorsaniz IZINIPTAL yazip 2780 e gonderebilirsiniz.;1;Promosyon;
Yasal Bilgi mesajidir Alanya 4 yildiz Otel 12 yas ucretsiz 4 Gece 5 Gun Tatil Hersey dahil 199 TL <URL>;1;Promosyon;
ACİL! Telefonunuzda virüs tespit edildi. Temizlemek için tıklayın: <URL>;0;Dolandiricilik;
Kartınız bloke edildi. İptal işlemi için görüşün: <PHONE>;0;Dolandiricilik;
Ahmet bey  mektubun  var;2;Normal;
İade talebiniz bekliyor. Kimlik doğrulama: <URL>;0;Dolandiricilik;
Kripto airdrop: 0.5 BTC kazanma şansı! Cüzdan adresinizi doğrulayın: <URL>;0;Dolandiricilik;
"Vatan'da bu haftasonu LG 42LB580N 42"" Smart LED Ekran 1199 TL, iPhone 5S 16 GB 1899 TL, İntel işlemcili Reeder A7IM Quad 7"" tablet 199 TL.Stoklarla limitlidir.";1;Promosyon;
E-Devlet: ceza işlemi başlatıldı. 48 saat içinde işlem yapmazsanız icra işlemi uygulanacaktır. Tel: <PHONE>;0;Dolandiricilik;
KOSGEB is kurmak isteyenlere, isletmelere 70.000 liraya kadar destek veriyor. Bilgi almak icin arayin <PHONE>;1;Promosyon;
Paraf uyesi BEYAZ ESYA ve ELEKTRONIK magazalarinda Paraf'inizi kullanin +5 TAKSIT veya 2 AY ERTELEME firsatindan yararlanin.Detay <URL>;1;Promosyon;
KOTON, ADIL ISIK, IDIL BABY ve MAYORAL URUNLERINDE net %50ye varan sezon indirimleri MOLACITY AVMDE BASLADI!!! MOLACITY AVM - BUYUK KIPA YANINDA;1;Promosyon;
Bu akşam 90'lar Türkçe Pop Parti, Sucuk-Ekmek ve Sıcak Şarap tadıyla Pala Pub'ta. Bu gece Türkçe Rock Parti, türkçe rock şarkılarla Kule Rock City'de. Bu gece Bir Nev-i Alaturka alaturka şarkılarla Nev Konseri Mandalin Sahnesinde. Bu haftasonu eğlenceye doyacaksınız;1;Promosyon;
Kampanya:Her 500TL'lik alisverise cekilisle cift kisilik tatil hediye <URL>;1;Promosyon;
uyarı! Kargo şirketi – vergisel yükümlülük tespit edildi. Hemen bilgi güncelleyin yoksa yasal takip başlatılacaktır. Tel: <PHONE>;0;Dolandiricilik;
Naptın Yunus maçı ordamı izliyon?;2;Normal;
Ödeme uyarısı: Son faturanız ödenmemiştir. Ödemeyi yapmak için: <URL>;0;Dolandiricilik;
SAYGILAR;2;Normal;
adidas Forum Avm Mağazasına Özel 2 Al 1 Öde Kampanyası Başladı Kaçırmayın.sms istemiyorsanız tıklayınız <URL>;1;Promosyon;
MOI'de her 100 TL alisverisinize FIAT 500 L'den iPhone 6S'e,Maldiv tatilinden Avrupa Kupasi Turkiye mac biletlerine yuzlerce hediye kazanma sansi sizi bekliyor!;1;Promosyon;
Bir süre kendini amorti etsin yeter;2;Normal;
Aliye iki kadro varmış diğeri hemşirelikmiş;2;Normal;
Paket teslim edilemedi. Yeni teslim tarihi seçmek için tıklayın veya <PHONE>;0;Dolandiricilik;
Paraf ile toplamda 500 TL ve uzeri yurtdisi harcamaniza ucak bileti harcamanizda gecerli %50'ye varan indirim firsati! Katilim kosullari ve detaylar icin <URL>;1;Promosyon;
YouTube: Telif hakkı uyarısı aldınız. Gelirleriniz durdurulmadan önce itiraz edin: <URL>;0;Dolandiricilik;
KAMPANYA: MUGLA DOMINO'S TA SECIME OZEL BUGUN VE YARIN BUYUK BOY PIZZA+1 LT COCA-COLA+ELMA DILIM PATATES SADECE 31,90 BU FIRSATI KACIRMA... <PHONE>;1;Promosyon;
Acil: Telekom - gümrükte bekliyor. 48 saat içinde işlem yapın yoksa şikayetçi olunacaktır. Link: <URL>;0;Dolandiricilik;
Kampanya: Marks&Spencer'da yaza ozel 5 gun, secili urunlerde %20 INDIRIM. Son gun 28 Haziran Pazar. Sms ret icin MS yazin 3525'e gonderin.;1;Promosyon;
Gizli gizli yazmışımdır kesin bayılırım küçük sürprizlere;2;Normal;
Paraf'tan %1,90 faiz orani ile UCRETSIZ, KOMISYONSUZ 5.000TL ye kadar Taksitli Nakit Avans Firsati! Son gun 31 Ocak! Detay: <URL>;1;Promosyon;
Hesap güvenliği için 2 adımlı doğrulama gerekmektedir. Hemen şu linke tıklayın: <URL>;0;Dolandiricilik;
"Araba carefour onunde al git :) biz izmite geciyoruz ya annem icin hatirla ;) pazar gelirim ben geri :)";2;Normal;
Fırsat paketini kaçırmayın! Fairy Platinum bulaşık deterjanı (100 kapsül + 960ml sıvı deterjan) 86 TL yerine kargo dahil 49,99 TL. <URL>;1;Promosyon;
Paraf ile 31 Aralik?a kadar Paraf uyesi giyim,aksesuar,kozmetik magazalarinda 50TL üzeri taksitli işlemlerde +4 taksit! <URL>;1;Promosyon;
Turkce kotu hemen anlasiliyor;2;Normal;
SON 4 GUN! Size ozel 20 TL indiriminizi 150 TL uzeri ilk alisverisinizde keyifle harcayin. Ustelik %70+%20 indirim devam ediyor. Bilgi: <PHONE>;1;Promosyon;
Kartınız 3D Securedoğrulamasından geçemedi. işlemi onaylamak için: <URL>;0;Dolandiricilik;
Saat 18:00'a kadar 500 TL ve uzeri alisverisinize aninda %5 indirim! Kampanya cep telefonu ve altin urunlerinde gecerli degildir. <URL>;1;Promosyon;
Tamamdir kardesim. İi hadi oyle olsun bakalim.??;2;Normal;
Kripto airdrop: 0.5 BTC kazanma sansı! Cüzdan adresinizi doğrulayın: <URL>;0;Dolandiricilik;
Kampanya - İlk alışverişinizde 50 TL chip-para kazanmak için Free nizi cüzdanınızdan çıkarın! 31 Aralık 'a kadar, Free niz ile akaryakıttan markete, giyimden elektroniğe dilediğiniz yerde yapacağınız ilk alışverişinize 50TL chip-para hediye! ;1;Promosyon;
ACİL! Tebrikler! Büyük ödülü kazandınız. Detaylar ve talep formu: <URL>;0;Dolandiricilik;
Paraf ile Ramazan ayina ozel 19 Temmuz'a kadar farkli gunlerde ve tek seferde yapacaginiz besinci 75 TL ve uzeri gida marketi harcamaniza 40 TL ParafPara! Katilmak icin RAMAZAN yaz bosluk birak kart son 6 haneyi 3404'e gonder! Bilgi: parafcard<URL>;1;Promosyon;
KIGILI'da Net %70 Indirim basladi! Ustelik spor pantolon, sweatshirt ve montlarda cok ozel fiyatlar sizinle. Bilgi: <PHONE>;1;Promosyon;
Sen de sağol grsz;2;Normal;
Eyvallah :);2;Normal;
DERIMOD'dan Anneler Gunu'ne ozel tum ayakkabi ve cantalarda %40 +2.urune ekstra %40 indirim daha. Ustelik World'e ozel 8 Taksit.Sms istemiyorsaniz: <PHONE>;1;Promosyon;
BASIN EKSPRESIN EN YENI PROJESINDE LANSMAN ONCESI %20YE VARAN FIYAT AVANTAJINI KACIRMAYIN. AIRPORT24, YATIRIMIN EN HAVALI HALI. <PHONE>;1;Promosyon;
Abim yarın sabah söyleyeyim mi şimdi fiyat alamadım .;2;Normal;
Faizsiz kredi fırsatı sizi bekliyor. Başvuru ve onay için: <URL>;0;Dolandiricilik;
O arada istersen kahve içmeye çıkalım;2;Normal;
Telekom: ödemeniz onaylanmadı. en geç 1 iş günü içinde işlem yapmazsanızhukuki süreç başlatılacaktır. Dosya no: 203896. Tel: <PHONE>;0;Dolandiricilik;
27 Eylul'e kadar Prima Premium Care Firsat Paketlerinden 3 adet ve uzeri alin, her pakette 10 TL indirim kazanin! <URL>;1;Promosyon;
iPhone'unuz sarjsiz kalmasin. Simdi Xtorm Sarjli iPhone 5/5s Kilifi 249,90 TL yerine 149,90 TL! Hemen siparis ver: <URL>;1;Promosyon;
HAFTANIN KAMPANYASI:EVINIZIN HAVASINI DEGISTIRECEK GOBLEN VE DESENLI KIRLENTLER 45TL YERINE 11.9TL. madamecoco<URL> (SMS ALMAMAK ICIN COCO YAZIN 5830'A GONDERIN);1;Promosyon;
Kimliğiniz çalındı.doğrulama için hemen giriş yapın: <URL>;0;Dolandiricilik;
Adalet Bakanlığı bildirimi: hesabınızdan yetkisiz çekim. Borç/ceza için işlem yapılacaktır. 1 hafta içinde tıklayın: Tel: <PHONE>;0;Dolandiricilik;
Kayıp paket: Kargonuz adres bilgisi eksik.doğrulamak için linke tıklayın: <URL>;0;Dolandiricilik;
Londra ya gidiyoruz, 3 kur kayit yaptiran um ogrencilerimize 3 hafta Londra da egitim ucretsiz bilgi icin <PHONE>;1;Promosyon;
Siz ogretmenlerimize ozel %1,39 oranli Finansor ile ihtiyaclarinizi 36 aya kadar taksitlendirin, ustelik hicbir masraf odemeyin. Finansor'e basvurmak icin 'OGRT' yazip bir bosluk birakarak, TC kimlik numaranizi 2310'a gonderin. Turkiye Finans. ;1;Promosyon;
"Tekrar doğum günün kutlu olsun kardeşim nice mutlu yılara ;))";2;Normal;
Sen gidecekmisin hamama;2;Normal;
Limitiniz yükseltildi. Sözleşme: <URL>;0;Dolandiricilik;
"şuan izleyebiliyorum sıkıntı yok gibi ;)";2;Normal;
uyarı! Kredi Kuruluşu – hesabınızdan yetkisiz çekim. Hemen bilgi güncelleyin yoksa yasal takip başlatılacaktır. Tel: <PHONE>;0;Dolandiricilik;
Onurlarda evde takılır. Kesin pes atar;2;Normal;
Gümrük Müdürlüğü hesabınızda şüpheli aktivite: ceza işlemi başlatıldı. Hemen kontrol edin: <URL>;0;Dolandiricilik;
Tatlım sevindim çok geçmiş olsun bakalım doktor ne diyecek taşınma telaşında hastanede;2;Normal;
Apple iPad Pro'nun 3 farkli modeli %5 indirim ile on satista! <URL>;1;Promosyon;
İnşallah. Ben orda çok güzel bir villa buldum 10 kişilik ama internet sitesine güvenemedim;2;Normal;
Ah güzelim ne diyeyim ben sana;2;Normal;
Paraf ile Teknosa'dan 750 TL ve uzeri alisverislere 75 TL ParafPara! Ustelik pesin fiyatina 8 taksitle.Son gun:30 Kasim. Detay: <URL>;1;Promosyon;
Is Bankasi'ndan Size Ozel Kosullarda On Onayli 25000 TL limitli Ihtiyac Krediniz Hazir!Bilgi: Mugla Sb DILEK DEMIR <PHONE>;1;Promosyon;
Mahkeme bildirimi: aboneliğiniz iptal edilecek. Borç/ceza için işlem yapılacaktır. hemen tıklayın: <URL>;0;Dolandiricilik;
Internet yetmiyor diyen faturali Woops'lular hemen 500MB EKLE yaz 4545'e gonder, haftalik 500MB paketini al, bekleme yapma devam et :) Iptalde paket ucreti alinir. Tanitim iptali icin IPT yazip 7672'ye gonderin.;1;Promosyon;
50TL BONUS! BONUSA UYE GIYIM,ELEKTRONIK,RESTORAN,CICEKCIDE HER 100TL HARCAMAYA 10TL,TOPLAM 50TL BONUS! ILK HARCAMADAN ONCE SUBAT YAZ 3340'A GONDER. BONUS<URL>;1;Promosyon;
ACİL! HEDİYE: Sosyal medya çekilişi kazandınız. Detaylar: <URL>;0;Dolandiricilik;
Tebrikler! Ücretsiz tablet kazandınız. Kargo ve vergi ücreti ödemesi için: <URL>;0;Dolandiricilik;
Artçi sallantilardir geçmis olsun;2;Normal;
Bir buçuk saat;2;Normal;
3000 TL limitli Avans Hesap icin son firsat! Bir imzaniz ile acilabilmesi icin subemize gelin, nakit sikintisi cekmeyin! Son gun 11 Mayis! Bilgi: <PHONE>;1;Promosyon;
Tamamdir kardesim. Cikarken ararim.;2;Normal;
Özel indirim kodunuz aktif. Hemen kullanmak için: <URL>;0;Dolandiricilik;
Paraf ile Enterprise da %45 Indirim ayricaligi! Enterprise merkez ofisleri, enterprise<URL>;1;Promosyon;
"Kampanya-Hyundai i10 ve i20'lerde 0 faiz ve ogretmenlere ozel 1.200TL'ye varan ekstra indirim firsati! Son gun 31 Aralik! Bilgi hynd.co/uCAg4asc Kod:HYO122 SMS almak istemiyorsaniz ucretsiz olarak ""HYN"" yazip 3607'ye gonderin. Mersis No:6417374276976368";1;Promosyon;
Bakamadim daha bi araya gelsek konussak iyi olur ben birazdan odaya gececem ararim;2;Normal;
Hemen cektim insanlar görmeden;2;Normal;
"Tamamdır geldi;) saolasın";2;Normal;
Hadi inşallah :);2;Normal;
United Sport Coolmax Tisort kargo dahil sadece 19,90TL! <URL>;1;Promosyon;
MART'TA 3 TAKSiT KEYFi!31/03'E KADAR GARANTi BANKASI KARTLARINIZLA Y.iCi 75-10000 TL PESiN HARCAMALARA 3 TAKSiT!SUPER YAZ 3340'A YOLLA garanti<URL>;1;Promosyon;
Telefon numaranızla ilgili acil bildirim: Ödeme talebi var. Sorunu çözmek için <PHONE>;0;Dolandiricilik;
BASIN EKSPRESIN EN YENI PROJESI AIRPORT24'TE LANSMAN FIRSATI DEVAM EDIYOR. %18 KDV DAHIL 253.300TL'DEN BASLAYAN FIYATLAR ICIN, <PHONE>;1;Promosyon;
Mobil bankacılık erişiminiz güvenlik nedeniyle engellendi.doğrulamak için <URL>;0;Dolandiricilik;
"Kusura bakma ben gec yazmisim kardesim :) minibusteyim ;) okulda gorusuruz :)";2;Normal;
Merhaba FreeZonelu, Esnek Firsat  kampanyasina katilim talebin alindi. 12 fatura donemi boyunca  Faturali Esnek Tarifesinden aylik 8 TL indirim ile yararlanabilirsin.;1;Promosyon;
BAYRAM FIRSATI DIDIM BEGONVILLE OTEL 4GECE 5GUN HERSEY DAHIL KISI BASI 699TL 0-12YAS ÜCRETSIZ 9 TAKSIT <PHONE>;1;Promosyon;
Hayirli kandiller. ;2;Normal;
Mahkeme hesabınızda şüpheli aktivite: aboneliğiniz iptal edilecek. Hemen kontrol edin: <URL>;0;Dolandiricilik;
Pardon bi sey soyledigini fark edemedim, gorusuruz demistim, duymadin galiba...;2;Normal;
Dikkat! Ödeme Merkezi tarafından ödemeniz onaylanmadı. hemen yoklama yapılacaktır. adli işlem başlatılacak. Link: <URL>;0;Dolandiricilik;
Nasip değilmiş;2;Normal;
SEZON FİNALİ! 9,99'a Elbise&Tunik-19,99'a Ayakkabı&Çanta!-49,99'a Kaban&Mont! tozlu<URL> Sms iptali içinTozlu yaz5306'ya gönder.Mersis:<PHONE>;1;Promosyon;
50TL bonus! Subat'ta giyim, elektronik,cicekcide Garanti Pos'larinda her 100TL harcamaya 10TL,toplam 50TL bonus! Ustelik Bonus Flas tan katilanlari 14 Subat'a ozel ekstra bir surpriz bekliyor!  Ilk harcamadan once KAZAN yaz 3340'a gonder .;1;Promosyon;
Boyuna gore ideal kilon kac olmali? Hemen Tikla ve Ogren --> <URL>;1;Promosyon;
Super Tarifede 30 gun yurtici HERYONE 3 dk.si 75 Kr, 1 SMS 33,25 Kr, 1 MMS 90 Kr! Ucretlere kampanya ve diger indirimleriniz varsa dahil degildir.;1;Promosyon;
KAMPANYA:Alfa Romeo Giulietta kazanmak icin SON GUN! <PHONE>;1;Promosyon;
Tamam bu villayı kiralıyorum o zaman;2;Normal;
Patronlar test surusunde! Yeni Doblo ile tanismak icin 7-8 Subat'ta iKRAM ve HEDiYELERLE dolu senligimize bekliyoruz (FETHiYE:<PHONE>;1;Promosyon;
BODRUM GÜMBET 4* ANADOLU OTEL 3 GECE 4 GÜN KISI BASI 499 TL + GECE DISCO TURU +0-12 YAS COCUK ÜCRETSIZ 6 TAKSIT <PHONE>;1;Promosyon;
Güle güle kullan;2;Normal;
Tum English Home hali ve kilimler %50 indirimle magazalarimizda ve <URL>;1;Promosyon;
Kampanya: Bayram hediyesi! 150 TL'ye varan hediye ceki kampanyasi 19 Temmuz'a kadar uzatildi! <URL>;1;Promosyon;
Hesap güvenliği için 2 adımlı doğrulama gerekmektedir. Hemen şu linke tıklayın: <URL>;0;Dolandiricilik;
Degerli Musterimiz, kalan dakikalarinizi ogrenmek icin sizi Online Hizmet Merkezimize davet ediyoruz. Ucretsiz uyelik icin <URL>;1;Promosyon;
Kimliğiniz çalındı.doğrulama için hemen giriş yapın: <URL>;0;Dolandiricilik;
Tebrikler! Büyük ödülü kazandınız. Detaylar ve talep formu: <URL>;0;Dolandiricilik;
Sosyal medya çekilişi kazandınız. Detaylar: <URL>;0;Dolandiricilik;
Kahvaltu mi :);2;Normal;
Datça ya da yakın olsa olurum her türlü;2;Normal;
Uzak mış ya;2;Normal;
Size ozel 40TL indirim firsatini kacirmayin! Garanti Bankasi kredi kartiniz ile TEKNOSA'dan yapacaginiz 400TL ve uzeri ilk alisverisinize aninda 40TL indirim icin kodunuz:8408342465556 Son gun: 9 Ekim Detay: bonus<URL>;1;Promosyon;
Yarin elinizde olur dedi sözde bakalim sinir oldum;2;Normal;
"Eyvallah ;)";2;Normal;
Adalet Bakanlığı güvenlik uyarısı: ödemeniz onaylanmadı.doğrulama için: <URL>;0;Dolandiricilik;
Geldim Yunus mehmeteyiz;2;Normal;
Limitiniz yükseltildi. Sözleşme: <URL>;0;Dolandiricilik;
Adalet Bakanlığı bildirimi: gümrükte bekliyor. Borç/ceza için işlem yapılacaktır. en geç 1 iş günü içinde tıklayın: Tel: <PHONE>;0;Dolandiricilik;
Sosyal medya çekilişi kazandınız. Detaylar: <URL>;0;Dolandiricilik;
Paraf ile Sigorta odemelerinizde 30 Kasim'a kadar 9 taksit ayricaligi! Detaylar icin <URL>;1;Promosyon;
Yeni sezon giyim urunlerinde 200TL'lik alisverisinizde gecerli 50TL,400TL'lik alisverisinizde gecerli 150TL Exclusive Card'iniza yuklenmistir. Detay <PHONE>;1;Promosyon;
Özel indirim kodunuz aktif. Hemen kullanmak için: <URL>;0;Dolandiricilik;
Kampanya: Üşümeye son! Bugüne özel HyTech termal boyalarda ekstra %25 indirim! <URL>;1;Promosyon;
Facebook Güvenlik: Hesabınızda anormal etkinlik tespit ettik. Oturum açıp doğrulayın: <URL>;0;Dolandiricilik;
Kampanya:Calvin Klein Eternity Summer Erkek Parfümü 99,90 TL'ye ayağınıza gelsin!<URL>;1;Promosyon;
Son çağrı: Elektrik Dağıtım - hesabınızdan yetkisiz çekim. bugün cevap vermezseniz hukuki süreç başlatılacaktır. Link: <URL>;0;Dolandiricilik;
FIRSAT yazin ucretsiz 2222'ye gonderin, 30 dakika gunluk konusma paketi kazanin! Markalarin indirim ve kampanyalarini da tum hatlarinizla ucretsiz ogrenin!;1;Promosyon;
Tamam bir konuşayım Onur'la;2;Normal;
Kayıp paket: Kargonuz adres bilgisi eksik.doğrulamak için linke tıklayın: <URL>;0;Dolandiricilik;
<URL>;1;Promosyon;
Paraf ile Teknosa?dan 750 TL ve uzeri alisverislere 75 TL ParafPara! Ustelik pesin fiyatina 9 taksitle. Son gun: 12 Aralik Detay: <URL>;1;Promosyon;
Yarısından çoğu bitti işte hayırlı olsun ben gelmiş olucam 13 ünde gelicem;2;Normal;
E-Devlet bildirim: Ödemeniz (1.250 TL) onaylanmadı. Ödemeyi tamamlamak için: <URL>;0;Dolandiricilik;
SUPERLIG HEYECANI DEVAM EDIYOR, %45 INDIRIMLI LIGTV ABONESI OLMAK ICIN, FIRSAT KODUNUZ: YD1YE1HEMEN ARAYIN <PHONE>;1;Promosyon;
GRATİS'in Renkli Dünyasına Hosgeldiniz. Gratis<URL> sifreniz:2507İzinli veri tabanımızda yer aldığınız için teşekkürler. Çıkış:GRATIS 3525 MK:0411035618800018;1;Promosyon;
DIGITURKE 1TL DAHI KURULM UCRETI ODEMEDN AYDA 1000ADET FILM+TUM BELGESEL VECOCUK KANALLARI SADECE 15TLHEMEN ARAYANA HD KANALLAR UCRETSIZ LIGTV HEDIYE<PHONE>;1;Promosyon;
Elektrik faturanızda anormal tüketim tespit edildi. İtiraz için <PHONE>;0;Dolandiricilik;
Yazdı daha cvp vermedi haber veriri heralde;2;Normal;
Apple IDdoğrulaması yapılmadı. hesabınızı kurtarmak için: <URL>;0;Dolandiricilik;
Aynen doğru ne kadar kilolu olursan dogum zor oluyormuş;2;Normal;
Paraf ile 31 Temmuz'a kadar Paraf uyesi giyim,aksesuar,kozmetik magazalarinda 50TL uzeri taksitli işlemlerde +4 taksit! <URL>;1;Promosyon;
Hosgeldin yuvana sağolasın tatlım kısmet artık;2;Normal;
Kredi kartınızdan şüpheli işlem. 24s içinde doğrulamazsanız bloke edilecek: <URL>;0;Dolandiricilik;
Tebrikler! Kampanya kazanımı: Büyük ödülünüzü almak için doğrulama yapın: <URL>;0;Dolandiricilik;
Bonus Amex'le her gune ekstra 5TL bonus!15 Subat'a kadar tek seferde 50TL ve uzeri harcadiginiz hergune 5TL bonus! 3340'a DAHA yaz,gonder bonus<URL>;1;Promosyon;
"Kampanya-Hyundai yilin otomobilinden yilin son firsati! i20 3.000TL'ye varan nakit indirimiyle sizleri bekliyor. Son gun 31 Aralik. Bilgi hynd.co/r6Vgjjba Kod:HYF121 SMS istemiyorsaniz ucretsiz olarak ""HYN"" yazip 3607'ye gonderin.Mersis6417374276976368";1;Promosyon;
5325555555 No lu Telefon üzerinden Internet bankaciligi ve cep subesine giris yapmaniz sonucu Banka tarafindan S6 cep telefonu kazandiniz.Bilgi icin.<PHONE>;1;Promosyon;
İyi iyi maşallah diyelim şimdi geldi marketten yemek yapıyoruz :);2;Normal;
Acil: Hizmet sağlayıcı - ceza işlemi başlatıldı. 3 gün içinde işlem yapın yoksa adli işlem başlatılacak. İletişim: <PHONE>;0;Dolandiricilik;
Tudors magazamizda 3 urun sadece 49,90TL! Ister gomlek, ister tisort ucretsiz kargo avantajiyla. Son gun 5 Agustos;1;Promosyon;
Instagram: Parolanız 3 kere yanlış girildi. Hesabınızı kurtarmak için: <URL>;0;Dolandiricilik;
Okulda değilim öğleden sonra uğrarım;2;Normal;
Tebrikler! Büyük ödülü kazandınız. Detaylar ve talep formu: <URL>;0;Dolandiricilik;
Tmm lazim olur die alicaktim ztn :));2;Normal;
Modayi Network ile takip edin. 30 Agustos tarihine kadar Cep Subesi'ne giris yapin, <URL>;1;Promosyon;
Adınıza dava dosyası açıldı;0;Dolandiricilik;
Sende de o tozluklardan 3 takim olmasi lazim birde formalar;2;Normal;
Nur güzelim nasılsın;2;Normal;
Kripto airdrop: 0.5 BTC kazanma şansı! Cüzdan adresinizi doğrulayın: <URL>;0;Dolandiricilik;
Çok yerde durdu abla şah Yen'i girdik Muğla'ya;2;Normal;
Analastikkk. Sen gittin mi o rotayi pazartesi gunu?;2;Normal;
TEK BILEK, TEK YÜREK ! Hemen satin almak icin: <URL>;1;Promosyon;
Çevrimiçi yarı zamanlı iş olarak seçildiniz;0;Dolandiricilik;
Tmm sen izliyorsun dimi macı;2;Normal;
BU BONUS KACMAZ! Havale bonusunu % 15'e, cepbank bonusunu % 20'ye cikardik. Her yerde bahis keyfini surerken, bonusla sansini katla! <URL>;1;Promosyon;
Kampanya- Yilin En Turuncu Indirimi Teknosa magazalari ve teknosa<URL>'da  kacirilmayacak firsatlarla sizleri bekliyor! Son gun: 31 Aralik. SMS almak istemiyorsaniz RET TEKNOSA yazin, 3347ye gonderin. Mersis 0836014439300012;1;Promosyon;
Barcin'da buyuk yil sonu indirimi basladi! Bu firsati kacirmayin. Mutlu yillar! SMS almak istemiyorsaniz RET268 yazip 4781'e gonderin. Mersis:142000836400019;1;Promosyon;
Son geldiğinde not aldığım filmler bunlar mı ikisi de bilgisayar oyunu çıkıyor :);2;Normal;
Gitti gidiyor çok güvenilir değil saçma sapan bir şey gelebilir. Mağazadan alınca garantili oluyor siteden alınca muhatap ta bulamayabilirsin;2;Normal;
