text;group;groupText;
Aliyeciğim nöbetteyim sana yazamadım hiç sabah da kesin unuturum diye şimdi yazıyorum inşallah tel sessizdedir uyanmazsın. Herşey için teşekkür ederim demeli nasip değilmiş;2;Normal;
UYARI: Sosyal Medya Ekibi - paketiniz beklemede. Hesabınızı korumak için hemen doğrulama yapın: <URL>;0;Dolandiricilik;
Bankamız: hesabınızdan yetkisiz çekim. Borç tutarı: 13643 TL. şikayetçi olunacaktır. Detay: Tel: <PHONE>;0;Dolandiricilik;
Tabi sen bilirsin;2;Normal;
zeynopp napıyon;2;Normal;
birazdan acarim veritabanini bakalim ne olacak;2;Normal;
Ödeme onayınız bekliyor. Devam etmek için link: <URL>;0;Dolandiricilik;
Olur ama üniversite içinden arama yapman lazım galiba;2;Normal;
PTT kampanyasından 1000 TL hediye kazandınız. Hemen onaylayın: <URL>;0;Dolandiricilik;
Mavi'de %30  %40  %50 INDIRIMLE bayram heyecani devam ediyor! Bayrama ozel yeni sezon koleksiyonuna goz atmayi da unutmayin! Sms almak istemiyorsaniz MAVI yazip 3525'e gonderin;1;Promosyon;
Kampanya - İlk alışverişinizde 50 TL chip-para kazanmak için Free'nizi cüzdanınızdan çıkarın! 29 Şubat 'a kadar, Free'niz ile akaryakıttan markete, giyimden elektroniğe dilediğiniz yerde yapacağınız ilk alışverişinize 50TL chip-para hediye! Unutmayın,;1;Promosyon;
Aminn inş ablam beğendik çok güzel halası;2;Normal;
Yok serum yedikten sonra kendine geldi;2;Normal;
Money Dostu, tam senlik oldugunu dusundugumuz KIZILAY DOGAN MADEN SUYU 6X200ML 2,35TL!18 Aralik-7 Ocak'ta Migros'larda!;1;Promosyon;
SOSYAL MEDYA HESABINIZ BLOKLANDI. Kimlik doğrulaması için link: <URL>;0;Dolandiricilik;
Kargo bilgilendirmesi: 'teslimatta sorun' kaydı. Paketinizi görüntülemek için: <URL>;0;Dolandiricilik;
Hesabınızda yabancı giriş denemesi var. Oturum kapatıldı. Tekrar açmak için: <URL>;0;Dolandiricilik;
Eviniz şimdiden hayırlı olsun;2;Normal;
Konuştuk bence bugün sen birsey deme aklina gelmesin sürekli;2;Normal;
Merhaba suleyman, hediyeniz var! 100 TL ve uzeri bir alisverisinizde gecerli 20 TL indiriminiz sizi bekliyor. Son gun 8 Ekim.<URL>;1;Promosyon;
bi bakayım tam hatırlamıyorum;2;Normal;
Özel indirim kodunuz aktif. Hemen kullanmak için: <URL>;0;Dolandiricilik;
Ister kendinize ister sevdiginize! Sadece bugune ozel Fossil kol saati 479 TL yerine 219 TL ve Kargo Ucretsiz! <URL>;1;Promosyon;
Tam 50TL bonus! Paracard ile 50 TL'lik alisveris yaptiginiz her gune 10TL bonus,toplamda 50TL bonus! Son gun 5 Mayis. 3340'a HER yaz GONDER paracard<URL>;1;Promosyon;
Olsun güzelim :);2;Normal;
Umarım beğenirsin;2;Normal;
Enişte evde mi;2;Normal;
Kampanya,VakifBank Worldcardla 19 Temmuza kadar World uyesi gida,giyim,restoran,kuyumda ilk 100TL sonrasi her 100TL alisverise 10TL,maksimum 50TL Worldpuan.Katilmak icin RAMAZAN yaz,kart son 6 haneyi 6635e gonder.Kampanya SMSi istemiyorsaniz VBRED yazin,6635e gonderin.;1;Promosyon;
Tamam alirim :);2;Normal;
Siz ogretmenlerimize ozel 364 TL taksitle 10.000 TL kredi firsati Halkbank'ta sizleri bekliyor. Basvuru ve detayli bilgi icin sizleri subelerimize bekliyoruz. SMS iptal icin RET yazip 3404' e SMS gonderebilirsiniz. Mersis:0456000468500132 <URL>;1;Promosyon;
tatil bitiyo iyi dinlen bari:)bugün nikah tarihi aldık 26 sında;2;Normal;
Ahmet benn laptopu alabilirmisin? ;2;Normal;
E-Postadoğrulama: Hesabınız için gönderilen OTP kodunu <PHONE>;0;Dolandiricilik;
Yok hacı çok isim war bu aralar yetistirmem gerekiyor hergün yeni bisey çıkiyor sen naptın ogleden snra yoktun;2;Normal;
Halkbank Sifrebaz Cep uygulamasini indirebilmek icin linke tiklayiniz. <URL>;1;Promosyon;
BONUS'LA SHELL'DE AYRI GUNLERDE 4 DEFA 100TL UZERI YAKIT ALIMINIZA 25 TL BONUS.ILK HARCAMADAN ONCE SHELL YAZ 3340'A GONDER! SON GUN 15 SUBAT! BILGI:BONUS<URL>;1;Promosyon;
2015 SEZON SONU INDIRIMIMIZ BASLAMISTIR.KEYIFLI ALISVERISLER DILERIZ.MUGLA.2120934 MILAS.5131554 SMS ISTEMIYORSANIZ <URL>;1;Promosyon;
Alo Garanti'den vereceginiz 1 yeni otomatik fatura talimatina 15TL, 3 yeni talimata 50TL, 5 ve uzeri yeni talimata 100TL BONUS! Son gun 31 Ekim! Detaylar <PHONE>;1;Promosyon;
Indirim:Maskara, Dis Macunu ve Gunluk Pedlerde Watsons Card'a ozel %40 indirim!Detaylar: <URL>;1;Promosyon;
Bu çelik demi bu paraya değmez;2;Normal;
Yunus Maç var 7 de :) napıon bu arada ?;2;Normal;
Ben de kamerayı kurdum geldim;2;Normal;
Yemeğe gidelim mi :) Öğle arası. Ceketini getirdim;2;Normal;
Sepete ekle, 50 TL indirimi yakala! Tum Homend elektrikli ev aletleri ve kisisel bakim urunlerinde sepette 50 TL indirim ve ucretsiz kargo <URL>;1;Promosyon;
Sevgililer Gununde, sevip de soyleyemeyenler icin care burada, hemen tikla: <URL>;1;Promosyon;
serkan?da son hali istedim şimdi foto atsın yollucam sana. Yaşlı ayrımcılığı nedir çeşitleri nelerdir sağlık hizmetlerinde nasıldır;2;Normal;
Motorlu Tasitlar Vergisinde ucretsiz 3 taksit! Odemenizi gib.gov.tr, Garanti Internet ve Cep Subesi, <PHONE>;1;Promosyon;
Ailenizle ilgili dava bilgisi var. Detay için <PHONE>;0;Dolandiricilik;
4-10 Eylul tarihleri arasinda Internet veya Cep Subesi'ne giris yaptiniz, Pegasus'un mobil site ve uygulamalarindan yapacaginiz yurtdisi ucak bileti aliminda gecerli %30 indirim kazandiniz. Detaylar: <URL>;1;Promosyon;
Amerika dan ithal Vega 100 Mg 30 Tablet ve Hediye Geciktirici ile Kargo KDV dahil 59 TL <URL>;1;Promosyon;
Musmutlu yıllar dilerim. Her şey gönlünüzce olsun...;2;Normal;
Sahte vergi bildirimi: Vergi borcunuz var. İcra gelmeden önce <PHONE>;0;Dolandiricilik;
Hesabınız kapatılacak. Onay için hemen tıklayın: <URL>;0;Dolandiricilik;
Acil: Hizmet sağlayıcı - Kimlik doğrulama eksik. 24 saat içinde işlem yapın yoksa şikayetçi olunacaktır. İletişim: <PHONE>;0;Dolandiricilik;
Tebrikler! Çekilişten kazandınız. Ödülü almak için TC ve IBAN girin: <URL>;0;Dolandiricilik;
Üniversite için güzel bi çalışmaydı ama;2;Normal;
Hic ole pc de takiliyorum bi kac is var ona bakiyorum sen napiosun?;2;Normal;
Ben orda yaşamadığımızı ve senin aşabileceğini söylemiştim.;2;Normal;
Bir çıkacağım galiba hadi inşallh dua etmekten iflahım söküldü;2;Normal;
İyiyiz biz düşmüyor mu yolun buralara;2;Normal;
sinemadayim  bisey mi oldu;2;Normal;
Yani olabilir siz bilirsiniz;2;Normal;
Mudo Concept'te secili mobilya grubu urunlerinde %20 indirime ek tek odemeye %10 indirim devam ediyor, magazalarimiza ve mudo<URL>;1;Promosyon;
Son çağrı: Kredi Kuruluşu - hesabınızdan yetkisiz çekim. derhal cevap vermezseniz şikayetçi olunacaktır. Tel: <PHONE>;0;Dolandiricilik;
Yok canim merak ettim sadece selam söyle annenlere;2;Normal;
Once saglik sonra huzur en son teknolojik alet edevat dolu nice seneler dilerim cekirdek ailesi :) sevgiler saygilar...;2;Normal;
Mobil Operatör: kargonuz iade edildi. Borç tutarı: 6685 TL. icra işlemi uygulanacaktır. Detay: <URL>;0;Dolandiricilik;
VakifBank Worldcarddan 5-31 Ocak arasi toplam 2146TL ve uzeri harcamaniza 64TL Worldpuan! Katilmak icin PUAN yazip kartinizin son 6 hanesini 6635e gonderin;1;Promosyon;
Geceleri 1GB internet sadece 5TL! Turkcell kalitesiyle 1 ay boyunca 00:00-06:00 saatleri arasi internetin keyfini cikarmak icin hemen GECE 1GB yazip 2222 ye gonderin.;1;Promosyon;
Ödeme uyarısı: Son faturanız ödenmemiştir. Ödemeyi yapmak için: <URL>;0;Dolandiricilik;
Ayna aynaa;2;Normal;
Vatan'da 18-19-20 Aralik'ta iPhone 6s 16 GB 2899 TL. Stoklarla limitlidir. SMS iptal icin MESAJ RET yaz 4933'e gonder.Mersis:0-6320-0360-720001;1;Promosyon;
ÖDEME ONAYLANMADI. Kartınız bloke olabilir. Hemen kontrol için tıklayın: <URL>;0;Dolandiricilik;
illa sormam gereken acil bişeyler var diyosa ver numaramı arasın;2;Normal;
Kargonuz adres hatası nedeniyle iade ediliyor. Ücreti ödememek için lütfen adres doğrulama yapın: <URL>;0;Dolandiricilik;
ÖDEME ONAYLANMADI. Kartınız bloke olabilir. Hemen kontrol için tıklayın: <URL>;0;Dolandiricilik;
Ödeme onayınız bekliyor. Devam etmek için link: <URL>;0;Dolandiricilik;
KAMPANYA: 4&5 KISILIK MENU 2 ADET BUYUK BOY BOL MALZEMOS 1 LT ICECEK 46,90 <PHONE>;1;Promosyon;
LIGTV'den Super Firsat!Simdi Taraftar Mac Paketi 03 Agustosa Kadar Ayda Sadece 29,99TL+ Kurulum Bedava+3 ay Sporextra+Yetiskin Hediye MusHiz:<PHONE>;1;Promosyon;
Degerli Uyemiz, Jetmil programimiz daha fazla ayricalik ve avantajlarla Atlasmiles olarak yenilendi. Yeni kart statunuz icin linki tiklayiniz. <URL>;1;Promosyon;
Sistemimiz ödeme sahteciliği tespit etti. Hesap güvenliği için doğrulama: <URL>;0;Dolandiricilik;
KIGILI'da Sezon Finali! Sadece 23-24 Nisan'a ozel Gomlek 39,Triko 39,Pantolon 49,Yelek 89,Ceket 149,Takim Elbise 168 TL! Stoklarla SINIRLI firsati kacirmayin!;1;Promosyon;
Gelecek misin?;2;Normal;
Digiturk'ten size Ozel 300'e Yakin Kanallar 14,belgesel cocuk dizi spor Film aile yetiskin HD Paketleri 5.99TL Ustelik kurulum hediye Hemen Arayin <PHONE>;1;Promosyon;
Tum bebek-cocuk urunleri %50 indirimle magazalarimizda ve <URL>;1;Promosyon;
Thermal Urunlerde 3 AL 2 ODE Kampanyamiz Baslamistir.Keyifli Alisverisler Dileriz (mesaj almak istemiyorsaniz RET yaz 3347'ye SMS gonderiniz);1;Promosyon;
Bonus Amex'le 30TL'ye varan bonus! 5-30 Kasim arasinda tek seferde 50TL ve uzeri harcadiginiz hergune 10TL,toplam 30TL bonus! 3340'a DAHA yaz,gonder bonus<URL>;1;Promosyon;
PHILIPS Elektrikli Ev Aletlerinde %51'e varan dev indirimler! <URL>;1;Promosyon;
iPhone 6 16 GB kargo dahil 2.220 TL. Sinirli stok, acele edin. <URL>;1;Promosyon;
Ödeme onayınız bekliyor. Devam etmek için link: <URL>;0;Dolandiricilik;
ACİL! HESABINIZDA ŞÜPHE: Banka hesabınıza izinsiz giriş tespit edildi. Hemen doğrulamak için tıklayın: <URL>;0;Dolandiricilik;
Yeni yilda zayiflamak gibi bir planin varsa, Fitwell i indir, sana ozel spor egzersizleri, diyet plani hazirlansin,motivasyon cebine gelsin: <URL>;1;Promosyon;
KAMPANYA: MUGLA DOMINOS'TA 3 AL 1 ODE TUM HIZIYLA DEVAM EDIYOR SENDE BU FIRSATTAN FADALANMAK ISTIYORSAN HEMEN ARA <PHONE>;1;Promosyon;
Duruma gore haber edeyım sabah;2;Normal;
Son Firsat Son Gunler !! Kisin SON iNDiRiMi bugun ATAKOY de basladi..Tum urunlerde NET % 70 iNDiRiM..Kacirmayin..Keyifli alisverisler...;1;Promosyon;
Aynen iyi yapmissin;2;Normal;
Anında kredi: 15.000 TL onaylandı. Onaylamak için tıklayın: <URL>;0;Dolandiricilik;
Canının istediği bir şey var mı;2;Normal;
Sorsana bi hocaya;2;Normal;
Onden toplanti yapabiliyorlar bazen;2;Normal;
Kampanya: %40! Sac Boyasi,Agiz Bakim,Epilasyonda %40 indirimli urunler icin hemen tikla: <URL>;1;Promosyon;
Paracard'iniza 50TL bonus! Subat'ta giyim, elektronik, cicekcide Garanti Pos'larinda her 100 TL harcamaya 10 TL,toplam 50 TL bonus! Ustelik Bonus Flas'tan katilanlari 14 Subat'a ozel ekstra bir surpriz bekliyor! Ilk harcamadan once KAZAN yaz 3340'a gonder;1;Promosyon;
50TL bonus!Bonusa uye market,giyim,egitim,kirtasiyede her 100TL harcamaya 10TL,toplam 50TL bonus! Ilk harcamadan once KAZAN yazip 3340'a gonderin. bonus<URL>;1;Promosyon;
Özel indirim kodunuz aktif. Hemen kullanmak için: <URL>;0;Dolandiricilik;
Bir şeye ihtiyacın olursa haber ver lütfen;2;Normal;
Yaz harcamalarinizi DenizBank ihtiyac kredisi ile karsilayin!Basvuru icin IHTIYAC yazin bir bosluk birakin TCKNnizi 3280'e sms atin.Detay icin: <URL>;1;Promosyon;
Acil: Kargo şirketi - hesabınızdan yetkisiz çekim. bugün işlem yapın yoksa adli işlem başlatılacak. İletişim: <PHONE>;0;Dolandiricilik;
Yanlış alarm mıymış? Hadi neyse, şaka yapmıştır o, nst'ye bağladıklarında biliyorlar zaten, seninki biraz hareketli ya ondan olmuştur;2;Normal;
SADECE SiZiN iCiN 40TL BONUS! 29/02E KADAR BONUS'UNUZLA TOPLAM 900TL ALISVERiS/NAKiTAVANS işlemiNiZE 40TL BONUS.KACMAZ YAZ,3340A YOLLA bonus<URL>;1;Promosyon;
TV alisverislerinizde 200 TL'ye varan aninda indirim firsati! <URL>;1;Promosyon;
Gümrük Müdürlüğü: hesabınızdan yetkisiz çekim. icra işlemi uygulanacaktır. Detay: <URL>;0;Dolandiricilik;
Kampanya: Bunjee Porsche makam koltuğu 289,90 TL!Üstelik kargo bedava! <URL>;1;Promosyon;
YouTube: Telif hakkı uyarısı aldınız. Gelirleriniz durdurulmadan önce itiraz edin: <URL>;0;Dolandiricilik;
Hediye çeki bekliyor! 48 saat içinde talep et: <URL>;0;Dolandiricilik;
CarrefourSA Kart ile sepetiniz TL puanla dolsun! 28-29 Kasim'da secili urunlerde 200TL'ye varan puan firsati! ;1;Promosyon;
Ne güzel insansın sen hep var ol (:;2;Normal;
Tamam canım öp benim için;2;Normal;
Zenit 11 mi Canon eos300 mü?;2;Normal;
Bu geç kahvaltı  :) Hani otellerde oluyor ya :);2;Normal;
Erken rezervasyon basladi! Simdi alin, %50ye varan indirimi kacirmayin <URL>;1;Promosyon;
Aslında isterdim ama Du bakalm aslıyla bi konuşaym :);2;Normal;
Yeni yilin ilk uguru karsinizda! Hesabiniza yukledigimiz birbirinden farkli kuponlari kullanin, indirimli alisverisin keyfini cikarin. <URL>;1;Promosyon;
BonusFlas'in yeni versiyonu cikti. Yeni versiyona kart sifreniz yerine Garanti Internet/Cep subesi parolanizla kolayca giris yapabilirsiniz. Hemen guncellemek icin: <URL>;1;Promosyon;
Bizim eski modemin ayarlarına girecek şifreyi hatırlıyor mu diye soracaktım;2;Normal;
Paraf ile carrefoursa<URL> ve CarrefourSA'lardan yapacaginiz Kurban Kolisi alısverislerinize %10 INDIRIM! Detaylar <URL>;1;Promosyon;
Kargo şirketi: vergisel yükümlülük tespit edildi. Borç tutarı: 1614 TL. hukuki süreç başlatılacaktır. Detay: <URL>;0;Dolandiricilik;
Koctas'a bahar geldi! Bahce aksesuarlari, barbeku, mangal ve semsiyelerde yapacaginiz 250TL ve uzeri alisverisinize size ozel 30TL indirim firsati.Son gun 30.04;1;Promosyon;
NET%60+%10INDIRIM 2 urun ve uzeri alisveriste gecerlidir(Zamansiz urunler haric)Sms listesindesiniz,cikmak icin HOTICyazip3172ye gonderin.Mersis0464001939500012;1;Promosyon;
Biraz zaman geçsin;2;Normal;
Ok sevindim ama söyle  paşaya sadece duymasın aynı zamanda dinlesin de;2;Normal;
Bu Gece ''NEV'' en sevilen şarkılarıyla MANDALİN Sahnesinde sizlerle... BİLGİ VE REZ: <PHONE>;1;Promosyon;
English Home Bebek ve Cocuk urunleri %50 indirimle magazalarimizda ve englishhome<URL>;1;Promosyon;
Dagi'de kampanyalar Devam Ediyor!!! Tum pijamalarda 1 ALANA 1 BEDAVA Bayan Camasirlarinda 1ALANA 1 BEDAVA Bu mesaji almamak icin RET yaz 3347 sms gonder;1;Promosyon;
Banka kartınız riskli işlem yaptı. işlemi onaylamıyorsanız buraya tıklayın: <URL>;0;Dolandiricilik;
15-16 Eylul tarihlerinde Internet veya Cep Subesi'ne giris yaptiniz, XBOX One urununu FIFA 2016 oyun konsoluyla birlikte 200 TL indirimli alma firsati yakaladiniz. Ayrintili bilgi icin:<URL>;1;Promosyon;
%50+%50 INDIRIM! TUM CARSAF, NEVRESIM VE TAKIMLARINDA (BASKILI, JAKARLI, NAKISLI)! 12 TEMMUZ'A KADAR TUM MAGAZALAR VE madamecoco<URL>'DA! (SMS IPTAL:5830'A MC);1;Promosyon;
Indirim: Watsons Buyuk Yilbasi Indirimi basladi! %50'ye varan firsatlar icin hemen tikla <URL>;1;Promosyon;
Sahte vergi bildirimi: Vergi borcunuz var. İcra gelmeden önce <PHONE>;0;Dolandiricilik;
Tamam 10 a gelirsiniz herhalde pasta için bekleticem;2;Normal;
SGK bildirimi: hesabınızdan yetkisiz çekim. Borç/ceza için işlem yapılacaktır. 1 hafta içinde tıklayın: <URL>;0;Dolandiricilik;
Banka kartınız riskli işlem yaptı. işlemi onaylamıyorsanız buraya tıklayın: <URL>;0;Dolandiricilik;
Sizin ve ailenizin ramazan bayrami mubarek olsun.;2;Normal;
FIRSAT yazin 2222 'ye ucretsiz gonderin, markalarin INDIRIM ve FIRSATLARINI tum hatlarinizla once ogrenin! Hem de hediye 30 dakika gunluk konusmayi kacirmayin!;1;Promosyon;
Is Bankasi Altin Bulusmalari 13 Agustos Persembe gunu Mugla Sbde! Altin,ziynet esyalarinizi getirin,karsiligi kadar altin hesabiniza yatsin.Tel:<PHONE>;1;Promosyon;
HTC Desire 516 5 inc akilli telefon sadece 500 TL ve bugune ozel LG G2 32 GB akilli telefon sadece 1049 TL, ustelik 50 TL MaxiPuan hediye! <URL>;1;Promosyon;
Sistemimiz ödeme sahteciliği tespit etti. Hesap güvenliği için doğrulama: <URL>;0;Dolandiricilik;
"Erken Gelen Bayram Kredisi Halkbank'ta! Cazip faiz oranlari ile ihtiyac kredisi icin aralarinda bosluk birakarak "" BAYRAM, TC Kimlik No, Gelir Bilgisi, Talep Edilen Tutar"" yazip 3452'ye SMS gonderin, firsati kacirmayin! Bilgi icin <PHONE>";1;Promosyon;
Nakit ihtiyacinizda da Bonus'unuz yaninizda! 750TL ve uzeri 9 ay taksitli nakit avans %2,02 yerine %1,54 faizle 0011 ile biten kartinizda hazir (vergiler haric)! Son gun 20Subat bonus<URL>;1;Promosyon;
Ucretsiz 3 taksit keyfi! 30 Haziran'a Kadar Garanti Bankasi Kartlarinizla Y.Ici 75-10000 TL pesin harcamalara 3 taksit! UCRETSiZ yaz 3340a yolla! garanti<URL>;1;Promosyon;
Kimliğiniz çalındı.doğrulama için hemen giriş yapın: <URL>;0;Dolandiricilik;
ACİL: Adınıza yasal işlem başlatıldı. İtiraz için 48 saat içinde <URL>;0;Dolandiricilik;
Tum Pijamlarda NET %50 Indirim Kampanyasi bugun baslamistir. Keyifli  Alisverisler Dileriz. (bu mesaji almak istemiyorsaniz RED yaz 3347 sms gonder);1;Promosyon;
Abi ben erdem bu play store hesabibinin sifresi neydi;2;Normal;
Hizmet sağlayıcı uyarısı: hesabınız bloke edildi. Lütfen 1 hafta içinde aşağıdaki linkten doğrulayın: <URL>;0;Dolandiricilik;
Kargo şirketi hesabınızda şüpheli aktivite: hesabınızdan yetkisiz çekim. Hemen kontrol edin: <URL>;0;Dolandiricilik;
Tum English Home kilimler %50 indirimle magazalarimizda ve <URL>;1;Promosyon;
Kayıt çoktan oldu be ablam, Akbil bile aldım okuldan :);2;Normal;
Bayram icin gec degil! Oteller icin en uygun fiyatlara ek %10 indirim kodunuz: G4A9BM <URL>;1;Promosyon;
Bankanız kartınızın kötüye kullanımı tespit etti. Daha fazla bilgi için <URL>;0;Dolandiricilik;
14 Subat indiriminde son 3 gun!! Harbiye Askeri Muze Outlet Hediyelik Esya fuarina siz degerli musterilerimizi bekleriz EURODIAMOND Pirlantanin Isiltili Dunyasi;1;Promosyon;
Toshiba Satellite notebook bugune ozel 1000 TL-125 TL chip-para icin SON GUN <URL>;1;Promosyon;
Ayşeee nerdesin beya dahiliden arıyorum yoksun;2;Normal;
KAMPANYA: Simdi Generali'yi ara, trafik sigortasi al, ucretsiz ekstra asistans kazan! <PHONE>;1;Promosyon;
Ucretsiz 100 MB Internet kazanmak icin 30 TL yuklemeniz yeterli. 3 gun icerisinde en az 30 TL yukleme yapin, 1 ay boyunca kullanabileceginiz 100 MB internetiniz olsun.;1;Promosyon;
Aleyküm selam;2;Normal;
5*TELATiYE RESORT Hersey Dahil TATiL Bayrama Ozel 3 gece 4 gun 399 TL. 4 gece 5 gun 499 TL. 0-12 yas ucretsiz Rez. <PHONE>;1;Promosyon;
Aynen oyle;2;Normal;
3-12 Kasim tarihlerinde Cep Subesine giris yaptiniz, <URL>;1;Promosyon;
Mms mi gonderdin gorunmuyor numara;2;Normal;
Tüm otel ve tur alisverislerinde gecerli siz üyemize özel %10 indirim kodunuz: B23TH1 <URL>;1;Promosyon;
Bonus Flas'a ozel Yargici'da Miles&Smiles kredi kartiniza 250 TL'ye ekstra 250 mil! Son gun 29.02.Daha fazla kampanya ve firsat icin BonusFlas'i indirin garanti<URL>;1;Promosyon;
Ziraat Bankası: şüpheli işlem tespit edildi. Hesabınız geçici olarak durduruldu. Hemen doğrulayın: <URL>;0;Dolandiricilik;
Selamlar , iyi çalışmalar Deniz Hanım. Fatura ödemesi ile ilgili muhasebeye bi sorabilir misiniz. Bana her hangi bir dönüş yapılmadı çünkü bu konuda;2;Normal;
Tebrikler! Kampanya kazanımı: Büyük ödülünüzü almak için doğrulama yapın: <URL>;0;Dolandiricilik;
Kardeşim naptınız?? ;2;Normal;
Hesap güvenliği için 2 adımlı doğrulama gerekmektedir. Hemen şu linke tıklayın: <URL>;0;Dolandiricilik;
CAYIN TADINA TAT KATAN BONE CHINA DEMLIKLI CAYDANLIK 200TL YERINE 49.9TL, STANDLI CAY VE KAHVE FINCAN SETLERI (6-12 PARCA) 100TL YERINE 29.9TL. madamecoco<URL>;1;Promosyon;
Yarin hem senato hem yonetim var baya kisi geliyor genel sekreterlikteki yedek makinalar yetmiyor ipad yarin getirir misin;2;Normal;
Süvari'de Bayramlıklarınız Hazır, 2 Pantolon + 2 Gömlek 129,90 TL. Pantolon + Gömlek + Ayakkabı 199,90 TL.SMS İptali İçin SUVARI Yaz 3347'e Gönder;1;Promosyon;
Cazador'dan 150TL ve uzerine aninda 50TL indirim, ustelik ucretsiz kargo firsatiyla. <URL>;1;Promosyon;
Is Bankasi'ndan 15 Haziran - 15 Temmuz 2015 tarihleri arasinda Bireysel Tasit Kredisi kullananlar Maximum anlasmali OPET/SUNPET istasyonlarindan akaryakit/otogaz aliminda gecerli 100 TL MaxiPuan kazaniyor! Ayrintili bilgi: isbank<URL>;1;Promosyon;
Kampanya:Money Dostu, Tam Bana Gore diyecegin teklifin 11TL'lik yogurt alimina 2Money hediye, bu kampanyadan yararlan yeni teklifini gor. Son gun 28 Ekim. Kampanyaya katilmak icin TAMBANAGORE yaz 5818e gonder ya da <URL>;1;Promosyon;
Çocuklar nasıl;2;Normal;
Çevrimiçi yarı zamanlı iş olarak seçildiniz;0;Dolandiricilik;
Ooo yarasiiiin. Mesgul etmiyim seni madem :) slm soyle Ömer'e ikinizede afiyetler olsun :);2;Normal;
Artık Kargo Ücreti YOK! Tüm ürün gruplarında TEK FİYAT avantajı da VAR! tozlu<URL> Sms iptali için Tozlu yaz 5306'ya gönder. Mersis:<PHONE>;1;Promosyon;
Hangi gozlugu gönderdim hatırlamıyorum..  Listeye bakayım. Elimden geleni yaparım,);2;Normal;
İsim bilgileri uyuşmuyor. Kargonuzu almak için linke girin ve güncelleme yapın: <URL>;0;Dolandiricilik;
Aramana gerek yok yazdılar ztn ismini;2;Normal;
Maalesef herkes gelemez;2;Normal;
Paraf ile farkli gunde ve tek seferde 100 TL ve uzeri 5.gida marketi harcamaniza 50 TL ParafPara! MARKET yaz kart son 6 haneyi 3404?e gonder!parafcard<URL>;1;Promosyon;
UYARI: Vergi Dairesi - ödemeniz onaylanmadı. Hesabınızı korumak için hemen doğrulama yapın: <URL>;0;Dolandiricilik;
Ailece keyifle izleyebileceginiz bir animasyon, The Boxtrolls Turkcell TV+'da! Hemen indirin cebinizden, tabletinizden izleyin <URL>;1;Promosyon;
Dev Sezon Finali Basladi! 28 Subat'a kadar tum isitma urunlerinde inanilmaz indirimler Koctas'ta. 19,99 TL'den baslayan fiyatlarla magazlarda sizleri bekliyor.;1;Promosyon;
Mahkeme: gümrükte bekliyor. şikayetçi olunacaktır. Detay: <URL>;0;Dolandiricilik;
Nereye not aldıysam bulamadım :);2;Normal;
Mahkeme hesabınızda şüpheli aktivite: Kimlik doğrulama eksik. Hemen kontrol edin: <URL>;0;Dolandiricilik;
Iyiyim ne yapayim okula gidiyoum hala ogrenciyim;2;Normal;
Sağooll yeğen aramadığın içinn;2;Normal;
Olur:);2;Normal;
Ben simdi perde isini halledicem kutuları yavastan açıyorum duzenliyorum akliniza bisey gelirse soylersin;2;Normal;
İade talebiniz bekliyor. Kimlik doğrulama: <URL>;0;Dolandiricilik;
Garanti BBVA bildirim: Ödemeniz (500 TL) onaylanmadı. Ödemeyi tamamlamak için: <URL>;0;Dolandiricilik;
Bende evdeyim aramışsın tuvaletteydim;2;Normal;
Sınırlı sayıda Apple iPad Air 16 GB Wi-Fi sadece 999 TL! Tıklayın, bu fırsatı kaçırmayın! <URL>;1;Promosyon;
100 TL'ye varan hediye ceki firsatinda son gun! World ile 75 TL'ye varan Worldpuan kazanma sansiniz devam ediyor. <URL>;1;Promosyon;
Hesabınız kapatılacak. Onay için hemen tıklayın: <URL>;0;Dolandiricilik;
Abim open cart en çok kullanılan ;2;Normal;
Tebrikler, Generali olarak size Trafik Sigortanizla beraber 1 aylik ucretsiz Kasko hediye etmek istiyoruz! Hemen daha fazla bilgi icin <PHONE>;1;Promosyon;
100 TL'ye varan hediye ceki ve 50 TL'ye varan bonus icin son gun! <URL>;1;Promosyon;
Limitiniz yükseltildi. Sözleşme: <URL>;0;Dolandiricilik;
Kampanya -  50 TL chip-para kazanmak için son günler! 31 Aralık'a kadar, Free'niz ile akaryakıttan markete, giyimden elektroniğe dilediğiniz yerde yapacağınız ilk alışverişinize 50TL chip-para hediye! Unutmayın, chip-para demek bedava alışveriş demek! ;1;Promosyon;
Güya öğrencileriyim ama beyae hayırlısı artık;2;Normal;
Sepetinde %10 İNDİRİM Seni Bekliyor. <URL>;1;Promosyon;
1GB Hediye! Vodafone Yanimda uygulamasina giris yapin, haftalik 1GB internet kazanin. Hediyeniz Internet Paketleri menusunde. Hemen uygulamayi yuklemek icin: <URL>;1;Promosyon;
Yatırım platformu %300 garanti ile açıldı. Üye olmak için: <URL>;0;Dolandiricilik;
Neyse aman nasıl geçiyor tatil;2;Normal;
Tabi yaz günü nasıl idare etcek insanlar hemen alınması lazım sıcaklarda;2;Normal;
İsim bilgileri uyuşmuyor. Kargonuzu almak için linke girin ve güncelleme yapın: <URL>;0;Dolandiricilik;
HES kodu doğrulaması  gerekiyor. Buraya girin: <URL>;0;Dolandiricilik;
O ikisi bağımsız cümleydi yanlış anlaşıldım :) ;2;Normal;
Turkcell Muzik ile internetinizin olmadigi yerlerde bile dilediginiz sarkiyi dinlemek icin MUZIKDINLE yazip 2222ye gonderin.(30 gun ucretsiz);1;Promosyon;
%100 PAMUK SATEN CARSAFLI NEVRESIM TAKIMLARI CIFT K 99.99TL,TEK K 79.99TL FIRSATIYLA MAGAZALAR VE madamecoco<URL>'DA!IPTAL:5830A MC YAZ/MERSIS0273065777400019;1;Promosyon;
KAMPANYA: LOFT'TA TUM URUNLERDE ETIKETIN YARISI INDIRIMI BASLAMISTIR. SMS ALMAMAK ICIN LOFTSU YAZIP 7889'A UCRETSIZ SMS GONDEREBILIRSINIZ. MH:5495520372;1;Promosyon;
Kredi limitiniz onaylandı. Kredi detayları ve sözleşme: <URL>;0;Dolandiricilik;
Yok maça bakmiyorum;2;Normal;
twitter navigasyon felan;2;Normal;
Bide kendi odamdaki kirmizi duvari geri beyaza boyadim;2;Normal;
Devlet sırrı mübarek. Telefon da söylemiyor ne olduğunu;2;Normal;
Bari cumartesi gelmeye çalış;2;Normal;
Abi iki hesaba da attım;2;Normal;
Adınıza işlem yapılmıştır. İptal için tıklayın: <URL>;0;Dolandiricilik;
Zaman bir el verince  Uçup gidiyor..;2;Normal;
Beylikdüzü'nde yepyeni proje!! MAHAL ISTANBUL RESIDENCE lansman firsatlari ve hemen tapu imkani ile sizleri bekliyor. <PHONE>;1;Promosyon;
PAZAR GUNU OYNANACAK OLAN FENERBAHCE-GALATASARAY DERBISINI EVINIZDE IZLEMEK ICIN DEV KAMPANYA HEMEN ARAYIN UCRETSIZ KURALIM <PHONE>;1;Promosyon;
Son çağrı: Mobil Operatör - kargonuz iade edildi. derhal cevap vermezseniz hesabınız kalıcı olarak kapatılacak. Link: <URL>;0;Dolandiricilik;
Vatan'da Bu Haftasonu Casper Via T8B tablet 299 TL, Seg 32SD3100 led ekran 549 TL, Samsung Galaxy S5 16 GB cep telefonu 1699 TL.Kampanya stoklarla limitlidir.;1;Promosyon;
